,Unnamed: 0,transcript,user_action,user_action_num
1248,1248,make the lights in the toilets brighter,IncreaseBrightness,2
1249,1249,make the lights less bright,DecreaseBrightness,3
1250,1250,can you gine the lights in the lounge,DecreaseBrightness,3
1251,1251,make the lights lass bright,DecreaseBrightness,3
1252,1252,make the lights more bright,IncreaseBrightness,2
1253,1253,make the lights more bright in the bedroom,IncreaseBrightness,2
1254,1254,make the lights not shine any more,SwitchLightOff,0
1255,1255,make the light spink,SetLightColor,5
1256,1256,make the late pink,SetLightColor,5
1257,1257,make the lights red,SetLightColor,5
1258,1258,make the lage thacolor read,SetLightColor,5
1259,1259,make the lights turn off,SwitchLightOff,0
1260,1260,make o light turn off in the waiting room,SwitchLightOff,0
1261,1261,can you increase the brightness of the lights in the bedroom,IncreaseBrightness,2
1262,1262,make the late sturn on,SwitchLightOn,1
1263,1263,make the living room dimmer,DecreaseBrightness,3
1264,1264,make the living room like dimon,DecreaseBrightness,3
1265,1265,make the lounge twenty two,SetLightBrightness,4
1266,1266,make a meeting room late fifte,SetLightBrightness,4
1267,1267,make the pantry five per cent in brightness,SetLightBrightness,4
1268,1268,make the pantry lights to twelve,SetLightBrightness,4
1269,1269,make the patio brighter,IncreaseBrightness,2
1270,1270,make the room a bit darker,DecreaseBrightness,3
1271,1271,make the room brighter,IncreaseBrightness,2
1272,1272,at just brightness to fifteen,SetLightBrightness,4
1273,1273,can you increase the brightness,IncreaseBrightness,2
1274,1274,make the studio lighting to be at the twelve setting,SetLightBrightness,4
1275,1275,make the studio light of,SwitchLightOff,0
1276,1276,make the toilet's green lights,SetLightColor,5
1277,1277,make twenty two the brightness steady,SetLightBrightness,4
1278,1278,may you change the like bin please,SetLightColor,5
1279,1279,more light please,IncreaseBrightness,2
1280,1280,more lights pace,IncreaseBrightness,2
1281,1281,mold e right maserping in the diming roombul fire,SetLightBrightness,4
1282,1282,my bedroom needs to be darker,DecreaseBrightness,3
1283,1283,no more lights in the garden,SwitchLightOff,0
1284,1284,can unicly the latening levellyin the studio,IncreaseBrightness,2
1285,1285,ok aluxta cut out flights in the pantry,SwitchLightOff,0
1286,1286,o khe gugle turn off light an entire flat,SwitchLightOff,0
1287,1287,o k gugle turn off lights,SwitchLightOff,0
1288,1288,once you enter the laundry room turn on the lights,SwitchLightOn,1
1289,1289,please turn on the light,SwitchLightOn,1
1290,1290,placed the cellarlights in the off position,SwitchLightOff,0
1291,1291,placed the lighting on level twenty two in the crucible,SetLightBrightness,4
1292,1292,please activate the lights,SwitchLightOn,1
1293,1293,please just the cubical light so it's brighter,IncreaseBrightness,2
1294,1294,please adjust the light brightness to go lower please,DecreaseBrightness,3
1295,1295,can you light up the basement a bit more,IncreaseBrightness,2
1296,1296,please adjust the light bulbs to twelve,SetLightBrightness,4
1297,1297,pleased brightened the lights in the meeting room,IncreaseBrightness,2
1298,1298,please change entrance lights to blue,SetLightColor,5
1299,1299,please change the lights to read and sniks,SetLightColor,5
1300,1300,please change the brightness in the room,DecreaseBrightness,3
1301,1301,cleas changed the brightness level in parking area to twenty,SetLightBrightness,4
1302,1302,please change the brightness level in the back yard to fifty,SetLightBrightness,4
1303,1303,please chain the color in the large meeting room to pink,SetLightColor,5
1304,1304,please jane the corar of the light thred,SetLightColor,5
1305,1305,please change the color to pink,SetLightColor,5
1306,1306,can you make it a tead brighter please,IncreaseBrightness,2
1307,1307,please change the collus to read in the bathroom,SetLightColor,5
1308,1308,please changed a light color in the kitchen to blue,SetLightColor,5
1309,1309,lease change the lighting to twelve in the shed,SetLightBrightness,4
1310,1310,please change the lights green,SetLightColor,5
1311,1311,please jane the likes in them waiting room for get inpits,SetLightColor,5
1312,1312,please change lights to read in the cellar,SetLightColor,5
1313,1313,face changed the lights to red,SetLightColor,5
1314,1314,please change the lights to twenty two in the house,SetLightBrightness,4
1315,1315,pleasta an the living room liht stured,SetLightColor,5
1316,1316,ple's cut off all light,SwitchLightOff,0
1317,1317,can you make it brighter inside,IncreaseBrightness,2
1318,1318,please decrease the brightness,DecreaseBrightness,3
1319,1319,please decrease the brightness,DecreaseBrightness,3
1320,1320,please dim lights,DecreaseBrightness,3
1321,1321,please demn the lights,DecreaseBrightness,3
1322,1322,lease plick the lights on,SwitchLightOn,1
1323,1323,please get rid of the lights,SwitchLightOff,0
1324,1324,please get the lights off,SwitchLightOff,0
1325,1325,please go on and increase the brightness,IncreaseBrightness,2
1326,1326,please have the waiting room be less bright,DecreaseBrightness,3
1327,1327,please incrase lights,IncreaseBrightness,2
1328,1328,can you make it dimmer and her,DecreaseBrightness,3
1329,1329,please increase the brightness of the lights,IncreaseBrightness,2
1330,1330,please increase the brightness of the lights in the kids room,IncreaseBrightness,2
1331,1331,please increase the brightness of the lights in the small meeting room,IncreaseBrightness,2
1332,1332,please increase the braveness of the late,IncreaseBrightness,2
1333,1333,please increase the garagelight,IncreaseBrightness,2
1334,1334,please increase the loating,IncreaseBrightness,2
1335,1335,please increased delights in the office,IncreaseBrightness,2
1336,1336,hes lo er the brightness for me,DecreaseBrightness,3
1337,1337,please lower the lights in the room,DecreaseBrightness,3
1338,1338,please lower the light,DecreaseBrightness,3
1339,1339,can you make the bedroom lights go up,IncreaseBrightness,2
1340,1340,please make it brighter,IncreaseBrightness,2
1341,1341,please make bocoler red,SetLightColor,5
1342,1342,please make te entine flat blue,SetLightColor,5
1343,1343,please make the flat room blue,SetLightColor,5
1344,1344,please make the light lieu,SetLightColor,5
1345,1345,please make to light red,SetLightColor,5
1346,1346,please make the lights brighter,IncreaseBrightness,2
1347,1347,please make the late green,SetLightColor,5
1348,1348,please make the light screen in the dining room,SetLightColor,5
1349,1349,please make the lates pink,SetLightColor,5
1350,1350,can you make the brightness twelfe,SetLightBrightness,4
1351,1351,please make delights pink in my bedroom,SetLightColor,5
1352,1352,please make the vestibule lighting to be at twelve,SetLightBrightness,4
1353,1353,please put off the panpulates,SwitchLightOff,0
1354,1354,please set it to five,SetLightBrightness,4
1355,1355,hese said lounch brightness at twenty to wesn't,SetLightBrightness,4
1356,1356,he said the night nat ler to figt,SetLightBrightness,4
1357,1357,please said the brightness to five persent,SetLightBrightness,4
1358,1358,pleased at the light brightnness level of basement to thirty nine,SetLightBrightness,4
1359,1359,he sert the liged welvs to champ,SetLightBrightness,4
1360,1360,please set the office lights down,DecreaseBrightness,3
1361,1361,can you make the lights blue,SetLightColor,5
1362,1362,please set the office to twenty two for the intensity,SetLightBrightness,4
1363,1363,please set the studio to level too for the light intensity,SetLightBrightness,4
1364,1364,please set the toilet lighting to two,SetLightBrightness,4
1365,1365,she said the toilet's room like to too,SetLightBrightness,4
1366,1366,please shut off the lighting,SwitchLightOff,0
1367,1367,clease shut off the lights above the toilet,SwitchLightOff,0
1368,1368,please shut off the lights,SwitchLightOff,0
1369,1369,please stop the lights,SwitchLightOff,0
1370,1370,pre switch my lights on now,SwitchLightOn,1
1371,1371,pleas switch on the lights for the facilities,SwitchLightOn,1
1372,1372,can you make the late breake,IncreaseBrightness,2
1373,1373,please whitch on my cubical life,SwitchLightOn,1
1374,1374,please return the lights,SwitchLightOn,1
1375,1375,please reach the color of the light to be red pleased,SetLightColor,5
1376,1376,rac switch to pink liding,SetLightColor,5
1377,1377,please to the green lade,SetLightColor,5
1378,1378,lease turn down the brightness,SwitchLightOff,0
1379,1379,please turn down the light intensity,DecreaseBrightness,3
1380,1380,please turn down the lights,DecreaseBrightness,3
1381,1381,please turn down the lights and the entrance area,DecreaseBrightness,3
1382,1382,please turn down the lights in the pantry,DecreaseBrightness,3
1383,1383,i've just a bedroom rightnest level to seventy three,SetLightBrightness,4
1384,1384,can you make the lights dimmer in the living room,DecreaseBrightness,3
1385,1385,please turn lights read in large meeting room,SetLightColor,5
1386,1386,please turn lights up,IncreaseBrightness,2
1387,1387,please turn my lighton,SwitchLightOn,1
1388,1388,please don't off on light,SwitchLightOff,0
1389,1389,please turn off all delights,SwitchLightOff,0
1390,1390,please turn off the sellar likes,SwitchLightOff,0
1391,1391,pleased turn off the lighting,SwitchLightOff,0
1392,1392,please tur not the lighting,SwitchLightOff,0
1393,1393,please turn off the lights in the bedroom,SwitchLightOff,0
1394,1394,please turn off the lites in the bedroom,SwitchLightOff,0
1395,1395,can you make the lights green in the basement,SetLightColor,5
1396,1396,these turn of the lights in the vestigule,SwitchLightOff,0
1397,1397,he's turt enough the lights in this room,SwitchLightOff,0
1398,1398,please dont off the light,SwitchLightOff,0
1399,1399,please tern of their tylad slates,SwitchLightOff,0
1400,1400,he turn on my parking lights,SwitchLightOn,1
1401,1401,please turn on the lights,SwitchLightOn,1
1402,1402,ease turn on the lights and the entrance,SwitchLightOn,1
1403,1403,leas ston on the leaving room lights,SwitchLightOn,1
1404,1404,please turned down the brightness of the light wolves just a bed i,DecreaseBrightness,3
1405,1405,please turn the brightness up,IncreaseBrightness,2
1406,1406,can you make the lights green,SetLightColor,5
1407,1407,please turn the sellalite to thirty nine,SetLightBrightness,4
1408,1408,these turned the kid's room brightness to fifty,SetLightBrightness,4
1409,1409,please turn the kitchen lights on,SwitchLightOn,1
1410,1410,please turn the light on for mou,SwitchLightOn,1
1411,1411,please turn the lights down,DecreaseBrightness,3
1412,1412,please turn the lights down in the waiting room,DecreaseBrightness,3
1413,1413,please turn the lights down to a lower setting in the living room,DecreaseBrightness,3
1414,1414,he turned the lightstone,DecreaseBrightness,3
1415,1415,please turn the lights off,SwitchLightOff,0
1416,1416,please tand the ladsov in the garden,SwitchLightOff,0
1417,1417,can you make delights in the office green,SetLightColor,5
1418,1418,cles turn the lights off in this rome,SwitchLightOff,0
1419,1419,please turn the living rom ligts to twelve,SetLightBrightness,4
1420,1420,please turn the pattio lights up for me,IncreaseBrightness,2
1421,1421,please turn up lights in apartment,IncreaseBrightness,2
1422,1422,turn up the lighting in the toilets,IncreaseBrightness,2
1423,1423,please ton of the lats a bit more,IncreaseBrightness,2
1424,1424,please turn up the lights,IncreaseBrightness,2
1425,1425,please decrease the brightness,DecreaseBrightness,3
1426,1426,please set the brightness of the lightbolt to seventy three,SetLightBrightness,4
1427,1427,power on the lamps,SwitchLightOn,1
1428,1428,can you made it outsi li green,SetLightColor,5
1429,1429,pawaran de lampe in the toilets,SwitchLightOn,1
1430,1430,power on the light,SwitchLightOn,1
1431,1431,haron lights in the bedroom,SwitchLightOn,1
1432,1432,power on the office lamps,SwitchLightOn,1
1433,1433,how are the cupical lamps to ten,SetLightBrightness,4
1434,1434,harl the lamps to two per cent,SetLightBrightness,4
1435,1435,paword the office lights,SwitchLightOn,1
1436,1436,put bathrem brightness to fifty,SetLightBrightness,4
1437,1437,pud like an in higher intentiou be pleased,IncreaseBrightness,2
1438,1438,foot lates too blue,SetLightColor,5
1439,1439,you please brighten this room up a bit,IncreaseBrightness,2
1440,1440,put on the lights in the cella at two per cent,SetLightBrightness,4
1441,1441,poot parking likes at level dwell,SetLightBrightness,4
1442,1442,wuld the bightnessinless sere that col be,SetLightBrightness,4
1443,1443,put the cellar lights to aff,SwitchLightOff,0
1444,1444,put the kid's bedroom lights on twelve,SetLightBrightness,4
1445,1445,put the lighting to level ten,SetLightBrightness,4
1446,1446,put the lights in the living room at level thirty nine,SetLightBrightness,4
1447,1447,wup their lives in the matingrom puswin,SetLightBrightness,4
1448,1448,put the lights off in the bedroom,SwitchLightOff,0
1449,1449,put the lights on,SwitchLightOn,1
1450,1450,and who pleased you the about room lage to ta colivered,SetLightColor,5
1451,1451,put the lights on please,SwitchLightOn,1
1452,1452,put the lights to twelve per cent in the bathroom,SetLightBrightness,4
1453,1453,put the lice to two in the back yard,SetLightBrightness,4
1454,1454,put the parking brightness at twenty,SetLightBrightness,4
1455,1455,quickly put on the lights in the dining room as i am very hungry,SwitchLightOn,1
1456,1456,raise the lights in the changing room,IncreaseBrightness,2
1457,1457,raise the lights and the laderu,IncreaseBrightness,2
1458,1458,reduce basement brightness to two per set,SetLightBrightness,4
1459,1459,duce brightness,DecreaseBrightness,3
1460,1460,reduce brightness to fiftee in the house,SetLightBrightness,4
1461,1461,the studio lights need to be increased,IncreaseBrightness,2
1462,1462,the toilet light should be blue,SetLightColor,5
1463,1463,and he said the likness to enter to a forthen badhouse,SetLightBrightness,4
1464,1464,the toilets should have green lighting,SetLightColor,5
1465,1465,there is too much light in here,DecreaseBrightness,3
1466,1466,there is too much light in the bedroom,DecreaseBrightness,3
1467,1467,throughout the house turn up the light power,IncreaseBrightness,2
1468,1468,toned down the brightness in the laundry room,DecreaseBrightness,3
1469,1469,ton'e all lighting on,SwitchLightOn,1
1470,1470,turnal likes them please,DecreaseBrightness,3
1471,1471,turn back yard lights off,SwitchLightOff,0
1472,1472,turn basement like its on please,SwitchLightOn,1
1473,1473,turn basement lade to pink,SetLightColor,5
1474,1474,can he set to cell of roome to seventy three,SetLightBrightness,4
1475,1475,don bedrom ladself a,SwitchLightOff,0
1476,1476,turn brightness down in bedroom,DecreaseBrightness,3
1477,1477,turn down bedroom lights,DecreaseBrightness,3
1478,1478,turned down lights in a trire apartment,DecreaseBrightness,3
1479,1479,turned down the basement lights,DecreaseBrightness,3
1480,1480,turned down the brightness,DecreaseBrightness,3
1481,1481,turn down the brightness for me,DecreaseBrightness,3
1482,1482,turned out the brightness to the loingery room,DecreaseBrightness,3
1483,1483,turned down the brightness of the lighting,DecreaseBrightness,3
1484,1484,dand on the breatness please,DecreaseBrightness,3
1485,1485,can ye set the kid's room light to five,SetLightBrightness,4
1486,1486,turned down the light in the bedroom,DecreaseBrightness,3
1487,1487,turn down the light lun de loo,DecreaseBrightness,3
1488,1488,turned down the light intensity in the dining room,DecreaseBrightness,3
1489,1489,turn down the light power all the way,SwitchLightOff,0
1490,1490,turned down the light power in the pantry all the way,SwitchLightOff,0
1491,1491,turned down the lighting in the kitceh bedroom,DecreaseBrightness,3
1492,1492,turn down the lights,DecreaseBrightness,3
1493,1493,turn down the lights a bit,DecreaseBrightness,3
1494,1494,can you please change the brightness in the kid's room to twenty two,SetLightBrightness,4
1495,1495,reduce the brightness in my bedroom as i am going to sleep,DecreaseBrightness,3
1496,1496,reduce the brightness in the bedroom please,DecreaseBrightness,3
1497,1497,reduced the light brightness in the backyard to level ten,SetLightBrightness,4
1498,1498,select pink light color,SetLightColor,5
1499,1499,set all lamps to level thirty nine in the studio,SetLightBrightness,4
1500,1500,set all lamps to too in the laundry room,SetLightBrightness,4
1501,1501,said brightness in pantry to seventy three persons,SetLightBrightness,4
1502,1502,set brightness to twenty pleas,SetLightBrightness,4
1503,1503,set cellar lights to fifty,SetLightBrightness,4
1504,1504,set light color to blue,SetLightColor,5
1505,1505,can you please change the brightness in the lounge to thirty nine,SetLightBrightness,4
1506,1506,sat lights to green,SetLightColor,5
1507,1507,set lights to level thirty nine,SetLightBrightness,4
1508,1508,set lights to lever twenty two,SetLightBrightness,4
1509,1509,setligtes to off,SwitchLightOff,0
1510,1510,set lights to twenty two per cent the basement,SetLightBrightness,4
1511,1511,set all lights to two in the perking room place,SetLightBrightness,4
1512,1512,fept leaving room bright leven to twenty two,SetLightBrightness,4
1513,1513,sad labbet blombe winte do for baglers,SetLightBrightness,4
1514,1514,set the basement lights to two,SetLightBrightness,4
1515,1515,set about in lights to the on position,SwitchLightOn,1
1516,1516,can you please change the color to blue,SetLightColor,5
1517,1517,fed the badroom lights to two for britness,SetLightBrightness,4
1518,1518,set the brightness in the bathroom at levell twall,SetLightBrightness,4
1519,1519,said the brightness in the bedroom to twenty two,SetLightBrightness,4
1520,1520,set the brightness in the kid's room to level twenty two,SetLightBrightness,4
1521,1521,sed the brightness in the living room to ten,SetLightBrightness,4
1522,1522,set them bright this level of light to twenty,SetLightBrightness,4
1523,1523,sot the brightness level to seventy three,SetLightBrightness,4
1524,1524,set the brightness of the lightwolbs to fifty,SetLightBrightness,4
1525,1525,set the brightness of the light bulbs to fifty,SetLightBrightness,4
1526,1526,seid pabratnas to fifty,SetLightBrightness,4
1527,1527,turn down the lights in here,DecreaseBrightness,3
1528,1528,turned down the lights and the basement,DecreaseBrightness,3
1529,1529,can you set the meeting room to be a pink hue,SetLightColor,5
1530,1530,turn down the lights in the bedroom,DecreaseBrightness,3
1531,1531,turn down the lights in thecella,DecreaseBrightness,3
1532,1532,turned down the lights in the changing room,DecreaseBrightness,3
1533,1533,turn down the lights in the kitchen,DecreaseBrightness,3
1534,1534,turned and the light in the large meeting rome,SwitchLightOff,0
1535,1535,turned down the lights in to toilet room,DecreaseBrightness,3
1536,1536,turned down the lights in the waiting room,DecreaseBrightness,3
1537,1537,turned down the lights one knotck,DecreaseBrightness,3
1538,1538,don don the lades please,SwitchLightOff,0
1539,1539,don on the labes,DecreaseBrightness,3
1540,1540,can you shut off the house lights,SwitchLightOff,0
1541,1541,turn light on in toilet rom,SwitchLightOn,1
1542,1542,turn lating read,SetLightColor,5
1543,1543,turn late in the laundry room breiter,IncreaseBrightness,2
1544,1544,turn on my lights everywhere please,SwitchLightOn,1
1545,1545,turn light on in the waiting room,SwitchLightOn,1
1546,1546,turn lights on over the toilet,SwitchLightOn,1
1547,1547,turn lights to green,SetLightColor,5
1548,1548,turn living room lights to red,SetLightColor,5
1549,1549,don't meeting room lights off,SwitchLightOff,0
1550,1550,turn on my living roemlightfles,SwitchLightOn,1
1551,1551,can you shet the lights off at the entrance,SwitchLightOff,0
1552,1552,turn off all the lamps,SwitchLightOff,0
1553,1553,turn off lights,SwitchLightOff,0
1554,1554,turn off my bedroom lights please,SwitchLightOff,0
1555,1555,ell nor's barking late,SwitchLightOff,0
1556,1556,ten after bottrom late,SwitchLightOff,0
1557,1557,dawn after celar plats,SwitchLightOff,0
1558,1558,turn off the light power,SwitchLightOff,0
1559,1559,turn off the lighting,SwitchLightOff,0
1560,1560,turn off phelites,SwitchLightOff,0
1561,1561,turn off the lights,SwitchLightOff,0
1562,1562,can you stop the lighting,SwitchLightOff,0
1563,1563,turn off the lights at four thirty p m,SwitchLightOff,0
1564,1564,turn off the lights for me,SwitchLightOff,0
1565,1565,don't know the lights for the leading room,SwitchLightOff,0
1566,1566,turn off the lights in five minutes,SwitchLightOff,0
1567,1567,turn off to lights in the basement,SwitchLightOff,0
1568,1568,turn off the lights in the bathroom,SwitchLightOff,0
1569,1569,turn off the lights in the bedroom,SwitchLightOff,0
1570,1570,turn off the lights in the bedroom,SwitchLightOff,0
1571,1571,tenolf telictin the tarreflect,SwitchLightOff,0
1572,1572,ton off the light in their drancs,SwitchLightOff,0
1573,1573,can you switch on my apartment lights,SwitchLightOn,1
1574,1574,turn off the lights in the kitchen,SwitchLightOff,0
1575,1575,turn off the lights in a living arom,SwitchLightOff,0
1576,1576,turn up the lights in the toilets,SwitchLightOff,0
1577,1577,turn off the light in this room,SwitchLightOff,0
1578,1578,turn off the light smell,SwitchLightOff,0
1579,1579,turnou lights to the basement,SwitchLightOff,0
1580,1580,turn off the lights to the toilets,SwitchLightOff,0
1581,1581,turn o folt the lanwage like,SwitchLightOff,0
1582,1582,danovtha bydi lates,SwitchLightOff,0
1583,1583,turn off the toiletlights,SwitchLightOff,0
1584,1584,adjust of brightness in the lew to fifty,SetLightBrightness,4
1585,1585,and he switched the lights on for my entire house,SwitchLightOn,1
1586,1586,turn on all the lights in the entire house,SwitchLightOn,1
1587,1587,turn on bedroom late,SwitchLightOn,1
1588,1588,turn on garoge light,SwitchLightOn,1
1589,1589,turn on lights above the toilet,SwitchLightOn,1
1590,1590,turn on lives in the backyards,SwitchLightOn,1
1591,1591,turn on lights into cellar,SwitchLightOn,1
1592,1592,dont on leaving room lights,SwitchLightOn,1
1593,1593,tut on my lights now,SwitchLightOn,1
1594,1594,tn are my pettyolights please,SwitchLightOn,1
1595,1595,turn on red light,SetLightColor,5
1596,1596,can you swiz the lights to dakalot gren plice,SetLightColor,5
1597,1597,turn on the batroom lights,SwitchLightOn,1
1598,1598,turn on the bedroom light,SwitchLightOn,1
1599,1599,turn on the changing room lights,SwitchLightOn,1
1600,1600,turned on the entrance lights,SwitchLightOn,1
1601,1601,turn on the laundry room waiting,SwitchLightOn,1
1602,1602,turn on te lights,SwitchLightOn,1
1603,1603,turn on the lights above the toilet,SwitchLightOn,1
1604,1604,turn on the light in the bathroom,SwitchLightOn,1
1605,1605,urn on the lights in the bedroom,SwitchLightOn,1
1606,1606,turn on the lights in the changing room,SwitchLightOn,1
1607,1607,can you ton down the light,DecreaseBrightness,3
1608,1608,turn er light in the entrans,SwitchLightOn,1
1609,1609,turn on the light in the kids room,SwitchLightOn,1
1610,1610,turn on the lights in the laundry ro,SwitchLightOn,1
1611,1611,turn on the lights an the waiting room,SwitchLightOn,1
1612,1612,turon the light please,SwitchLightOn,1
1613,1613,turn on the light,SwitchLightOn,1
1614,1614,turn on the office lighting,SwitchLightOn,1
1615,1615,turn on the office lights,SwitchLightOn,1
1616,1616,turn on the pantry light,SwitchLightOn,1
1617,1617,turned the spotlight in the room,SwitchLightOn,1
1618,1618,can you turn off the sella lites,SwitchLightOff,0
1619,1619,turn on the tollet lights,SwitchLightOn,1
1620,1620,turn out the cellar lights,SwitchLightOff,0
1621,1621,turn parking light setting to off,SwitchLightOff,0
1622,1622,turn studio lights on,SwitchLightOn,1
1623,1623,turn the backyard lights pink,SetLightColor,5
1624,1624,turn the basement line to see te ten,SetLightBrightness,4
1625,1625,turn the basement lats down,DecreaseBrightness,3
1626,1626,throun the bedroom light a,SwitchLightOff,0
1627,1627,turn the bedroom light to seventy three,SetLightBrightness,4
1628,1628,turn the bedroom lights on,SwitchLightOn,1
1629,1629,can you turn off the light in the toilet,SwitchLightOff,0
1630,1630,turn the bedroom to twenty,SetLightBrightness,4
1631,1631,tan the bratness done,DecreaseBrightness,3
1632,1632,turn the brightness down in the loping room,DecreaseBrightness,3
1633,1633,turn the brightness down in the toilet room,DecreaseBrightness,3
1634,1634,turn the brightness in the flat to two,SetLightBrightness,4
1635,1635,turn the brightness to level twelve,SetLightBrightness,4
1636,1636,turn the brightness to thirty nine per cent,SetLightBrightness,4
1637,1637,turn the brightness up in the basement,IncreaseBrightness,2
1638,1638,turne the bold brightness down,DecreaseBrightness,3
1639,1639,turn the bulbs on briter everywhere,IncreaseBrightness,2
1640,1640,can you turk off your lits,SwitchLightOff,0
1641,1641,turned the sella lights to twelve forset,SetLightBrightness,4
1642,1642,turn the cellar lights to fifty per cet,SetLightBrightness,4
1643,1643,and turned the changing ri lights ong,SwitchLightOff,0
1644,1644,turn the changing room lights to ten per cent,SetLightBrightness,4
1645,1645,turn the cubical lights to level ten,SetLightBrightness,4
1646,1646,turne the entrance lights on,SwitchLightOn,1
1647,1647,turn the entrance lights on,SwitchLightOn,1
1648,1648,turn the flat light to twelve,SetLightBrightness,4
1649,1649,turn the flat room off,SwitchLightOff,0
1650,1650,turn the garden light up a notch,IncreaseBrightness,2
1651,1651,get it out of the lights for the node room,SwitchLightOff,0
1652,1652,turn the kid's bedroom lit read,SetLightColor,5
