,Unnamed: 0,transcript,user_action,user_action_num
851,851,i want the lights on at the two sitting,SwitchLightOn,1
852,852,went to like john for the entire plot please,SwitchLightOn,1
853,853,i want the lights on dow,SwitchLightOn,1
854,854,a want the lights set to fifty in the kidsroom,SetLightBrightness,4
855,855,i wont the lights to be at level twenty two,SetLightBrightness,4
856,856,brighten up the cubicle,IncreaseBrightness,2
857,857,i want the lights to be blue in the bathroom,SetLightColor,5
858,858,i want the lights to be brighter,IncreaseBrightness,2
859,859,i want the lights to be changed to blue,SetLightColor,5
860,860,i want the lights to be demmed,DecreaseBrightness,3
861,861,i want the lights to be increased in brightness,IncreaseBrightness,2
862,862,i want the lights to be increased,IncreaseBrightness,2
863,863,i want the lights to be lowered,DecreaseBrightness,3
864,864,i want the lights to be read pleased,SetLightColor,5
865,865,i want the lights to be turned off,SwitchLightOff,0
866,866,i want delights to be turned off in the vestibule,SwitchLightOff,0
867,867,brater,IncreaseBrightness,2
868,868,i want the light s turn down in the bedroom,DecreaseBrightness,3
869,869,i want to lounge light on,SwitchLightOn,1
870,870,i want the parkning lights off,SwitchLightOff,0
871,871,when de pelyo like turne don,SwitchLightOn,1
872,872,i want the petio room lights off,SwitchLightOff,0
873,873,i want the room brighter,IncreaseBrightness,2
874,874,i want thi studio to be dark,SwitchLightOff,0
875,875,what the toilet lights off,SwitchLightOff,0
876,876,i want the tollet lights to be at twelve,SetLightBrightness,4
877,877,i want the toilet lights to be on,SwitchLightOn,1
878,878,bagnas exist to pen in kets down peace,SetLightBrightness,4
879,879,i warnt e wes yo will write passon seven pictory poser,SetLightBrightness,4
880,880,i want the vestibule to shine at twelve per cent,SetLightBrightness,4
881,881,i want the waiting room lights at a ten,SetLightBrightness,4
882,882,i want this room at brighkness level ten,SetLightBrightness,4
883,883,i want to brighten the laundry room,IncreaseBrightness,2
884,884,i want to change a board rom brightness to ten pleas,SetLightBrightness,4
885,885,i want to change the light green,SetLightColor,5
886,886,i want to change the light to blue instead,SetLightColor,5
887,887,i want two lights to a lower setting place,DecreaseBrightness,3
888,888,i want to low en my apartment lights please,DecreaseBrightness,3
889,889,litna should be said to dwellponsen,SetLightBrightness,4
890,890,i want to make the light dimmer,DecreaseBrightness,3
891,891,i want to make the room brighter,IncreaseBrightness,2
892,892,i one two said te lay two ten,SetLightBrightness,4
893,893,i want to turn off the lights,SwitchLightOff,0
894,894,i want to turn off the patyo lamps,SwitchLightOff,0
895,895,i want to change the brightness level in the patio to ten,SetLightBrightness,4
896,896,i want you to switch off all the lights and my cubicle,SwitchLightOff,0
897,897,i want you to turn off the lights in the small meeting room,SwitchLightOff,0
898,898,i want you to turn the lights off in my room pleace,SwitchLightOff,0
899,899,brightness to seventy three pleas,SetLightBrightness,4
900,900,would like for the light to be brighter,IncreaseBrightness,2
901,901,i would like for the lifes to be p,SetLightColor,5
902,902,i would like green lights please,SetLightColor,5
903,903,i would like lights on inside the house,SwitchLightOn,1
904,904,i would like pink lights please,SetLightColor,5
905,905,i wond like o ride petlevell in the batnon  we thirty nine,SetLightBrightness,4
906,906,o'd like the brightness of the lights to be levelled fo you,SetLightBrightness,4
907,907,i would length the gragelates on fifty,SetLightBrightness,4
908,908,i'ld like the lights to be turned on,SwitchLightOn,1
909,909,i would like the lights less bright,DecreaseBrightness,3
910,910,activate telights,SwitchLightOn,1
911,911,bring darkness to this room by turning off the lights,SwitchLightOff,0
912,912,i would like the lights to change to green,SetLightColor,5
913,913,i would likhe the lights turned off,SwitchLightOff,0
914,914,ild leg the lawns late on,SwitchLightOn,1
915,915,i won't like tha estomin to be be,SetLightColor,5
916,916,i would like the waiting room lights turned up,IncreaseBrightness,2
917,917,i would prefer that the changing room lights be lowered,DecreaseBrightness,3
918,918,i'd light these lights on,SwitchLightOn,1
919,919,i would like our leds off,SwitchLightOff,0
920,920,i'd like for my lights to be fluffed on now,SwitchLightOn,1
921,921,i will lake for the lates to be blue,SetLightColor,5
922,922,bring the cellar lights up to two,SetLightBrightness,4
923,923,i'd like for the lights to go on now,SwitchLightOn,1
924,924,i'd like it a little docke,DecreaseBrightness,3
925,925,i like more lighting in the bedroom,IncreaseBrightness,2
926,926,i'd like the bedroom lights to be at ten per cent,SetLightBrightness,4
927,927,i ded like the brightness changed in the shade,SwitchLightOff,0
928,928,ou'd like the brightness head to twenty,SetLightBrightness,4
929,929,like the bright is turned down,DecreaseBrightness,3
930,930,i like to breakness tarnup,IncreaseBrightness,2
931,931,id light the brightness turned up in the garage,IncreaseBrightness,2
932,932,i'd like the house lights to be set to twelve,SetLightBrightness,4
933,933,can the changing room lights be turned on,SwitchLightOn,1
934,934,i'd like the kitchen to be brighter,IncreaseBrightness,2
935,935,i liked the light to increase in the pantry,IncreaseBrightness,2
936,936,i like the lives on the interenst to be on,SwitchLightOn,1
937,937,i like the lights on the laundry room to be at level twenty two,SetLightBrightness,4
938,938,like the light shoff in the vestibule,SwitchLightOff,0
939,939,i'd like the lights to be shut off,SwitchLightOff,0
940,940,i like the lives to be shut down,SwitchLightOff,0
941,941,i like the life to be turned on,SwitchLightOn,1
942,942,can the laundry room have green lights,SetLightColor,5
943,943,i'd like the lights to change in a large meeting room,SwitchLightOff,0
944,944,i'd like the lights to not be so bright,DecreaseBrightness,3
945,945,i'd like the lights turned down in the kid's room,DecreaseBrightness,3
946,946,i'd like the living room lights to be at twelve per cent,SetLightBrightness,4
947,947,i would like the pocket my stupidid,SetLightColor,5
948,948,i'd like the vestibule lighting to be at thirty nine,SetLightBrightness,4
949,949,i'd like to activate lights in my cubicol,SwitchLightOn,1
950,950,i like to have pink lighting in the bathroom,SetLightColor,5
951,951,iwuld like to lights to be green pleased,SetLightColor,5
952,952,i'd like to lower the lights in the bedroom,DecreaseBrightness,3
953,953,can the lifts be read instead,SetLightColor,5
954,954,i've prefered the lights were on now,SwitchLightOn,1
955,955,i'd prefer it to be brighter,IncreaseBrightness,2
956,956,i'd prefer the bathrom light to be at thirty nine,SetLightBrightness,4
957,957,and prefer the laundry rom lights to be turned to green,SetLightColor,5
958,958,i'd prefer the lights to be on,SwitchLightOn,1
959,959,i'd prefer the office lights to be on,SwitchLightOn,1
960,960,i'ld prefer the toil et lighting to be at level dwellin,SetLightBrightness,4
961,961,i'm gone with the lights in the dining room,SwitchLightOff,0
962,962,i'm in the basement please turn the lights on,SwitchLightOn,1
963,963,i'm in the kitchen and i need some lights,SwitchLightOn,1
964,964,can the living room lights be turned off,SwitchLightOff,0
965,965,i'm in the kitchen can you give me some lights please,SwitchLightOn,1
966,966,illuminate the entrance,SwitchLightOn,1
967,967,in the basement turned the brightness to twenty,SetLightBrightness,4
968,968,in the bat room turn up the light power,IncreaseBrightness,2
969,969,in the changing room turned down the light power,DecreaseBrightness,3
970,970,and the cubicle and switch off the lights,SwitchLightOff,0
971,971,in the entrance changed the collars to red,SetLightColor,5
972,972,in the entrance make the lights pink,SetLightColor,5
973,973,in the gradge changed the lights to pink,SetLightColor,5
974,974,in the kit's bedroom make the late pink,SetLightColor,5
975,975,and were changed the house lighting to twelve,SetLightBrightness,4
976,976,an their kid's bedroom turned the lights off,SwitchLightOff,0
977,977,in the laundry room turned down the light power,DecreaseBrightness,3
978,978,in the leaving room make the lights green,SetLightColor,5
979,979,in the lounge change it to level two,SetLightBrightness,4
980,980,in the lounge turned the lights off,SwitchLightOff,0
981,981,in the pantry turned down the brightness,DecreaseBrightness,3
982,982,in the pantry turn up the brightness,IncreaseBrightness,2
983,983,in the small meeting room the lights must be pink,SetLightColor,5
984,984,and the cellar set the brightness of the lightbolds to twelte,SetLightBrightness,4
985,985,increase brightness please,IncreaseBrightness,2
986,986,can we change sail lights to anything but pink,SetLightColor,5
987,987,increase brightness to fifty,SetLightBrightness,4
988,988,increase brightness to seventy three,SetLightBrightness,4
989,989,inquiries lad breadness,IncreaseBrightness,2
990,990,increase light intensity,IncreaseBrightness,2
991,991,increase lighting in entire apartment,IncreaseBrightness,2
992,992,increase lighting in small meeting room,IncreaseBrightness,2
993,993,increase lights in entire house,IncreaseBrightness,2
994,994,increase the braveness in the changing room,IncreaseBrightness,2
995,995,increased the brightness of the basement,IncreaseBrightness,2
996,996,increased the brightness of the kitchen lights,IncreaseBrightness,2
997,997,can we make the whole house af twenty two,SetLightBrightness,4
998,998,increase the bratness of the late in the cellar,IncreaseBrightness,2
999,999,increase the briateness of the late in the dining room,IncreaseBrightness,2
1000,1000,increase the brightness of the late in the entrance,IncreaseBrightness,2
1001,1001,increase the brightness of the lights,IncreaseBrightness,2
1002,1002,increase the brightness of this rom,IncreaseBrightness,2
1003,1003,increase the brightness to seventy three,SetLightBrightness,4
1004,1004,increase the brightness to ten,SetLightBrightness,4
1005,1005,torace the cubicle's light intensity,IncreaseBrightness,2
1006,1006,increased the intensity of the lighting,IncreaseBrightness,2
1007,1007,incrised the intensity of the liding pleafs,IncreaseBrightness,2
1008,1008,green light in the shed,SetLightColor,5
1009,1009,increased the intensity of the lates,IncreaseBrightness,2
1010,1010,incresed eyed in a changin room,IncreaseBrightness,2
1011,1011,increased the light intensity,IncreaseBrightness,2
1012,1012,increase the light intensity in the vestibule,IncreaseBrightness,2
1013,1013,increase the lighting,IncreaseBrightness,2
1014,1014,increased the lighting in the cupicle,IncreaseBrightness,2
1015,1015,increase the lighting in the vestibule,IncreaseBrightness,2
1016,1016,increase the lighting intensity,IncreaseBrightness,2
1017,1017,increase the lighting intensity please,IncreaseBrightness,2
1018,1018,increased the lights in the bedroom,IncreaseBrightness,2
1019,1019,activ ith atton it's light,SwitchLightOn,1
1020,1020,can you change the bathroom light blue,SetLightColor,5
1021,1021,increase the lates in the garden,IncreaseBrightness,2
1022,1022,increase the late in the dilet,IncreaseBrightness,2
1023,1023,increase telights on the patio,IncreaseBrightness,2
1024,1024,increase the late spleece,IncreaseBrightness,2
1025,1025,increase the lights it is too dark,IncreaseBrightness,2
1026,1026,is it possible to turn down the brightness,DecreaseBrightness,3
1027,1027,is it oky for you to decrease the brightness of the lights,DecreaseBrightness,3
1028,1028,is it possible for you to turn the lights up in the cellar for us,IncreaseBrightness,2
1029,1029,is it possible to get the lounge brightness to five,SetLightBrightness,4
1030,1030,is it possible to tun down the brateness in the kitchbetroom,DecreaseBrightness,3
1031,1031,can you change the color of the lights to read in the lodge geating room,SetLightColor,5
1032,1032,is it possible to turn on studio light,SwitchLightOn,1
1033,1033,is it possible to turn the lights on,SwitchLightOn,1
1034,1034,is it possible to turn the lights down in this room,DecreaseBrightness,3
1035,1035,is there away to turn the kitchen lights to red,SetLightColor,5
1036,1036,is there anyway you can change the light buby blue,SetLightColor,5
1037,1037,it is too dark on the patio increase the lights,IncreaseBrightness,2
1038,1038,it is two dark more lights,IncreaseBrightness,2
1039,1039,it's tall bright in here,DecreaseBrightness,3
1040,1040,it's too bright wring the lights down,DecreaseBrightness,3
1041,1041,stoo bright please make it darker,DecreaseBrightness,3
1042,1042,then you chan ty kits room to rait,SetLightColor,5
1043,1043,it's too dark an here,IncreaseBrightness,2
1044,1044,it's too dark in here brighten the lights a bit,IncreaseBrightness,2
1045,1045,too dark in the bedroom,IncreaseBrightness,2
1046,1046,too dark in the waiting room,IncreaseBrightness,2
1047,1047,as way thro dark en here,IncreaseBrightness,2
1048,1048,kill the bathrnmites,SwitchLightOff,0
1049,1049,kill the lights in the bedroom,SwitchLightOff,0
1050,1050,killed the likes in the attire apartment,SwitchLightOff,0
1051,1051,letson abrightness for me,DecreaseBrightness,3
1052,1052,lesten the brightness of the lights in the bedroom,DecreaseBrightness,3
1053,1053,can you change the light in the garden to pink,SetLightColor,5
1054,1054,let there be light,SwitchLightOn,1
1055,1055,legsty an the garit lighting te guende deau,SetLightBrightness,4
1056,1056,let's have rud lights,SetLightColor,5
1057,1057,let's have the entrance be read,SetLightColor,5
1058,1058,let now the intensity of the lights,DecreaseBrightness,3
1059,1059,let make the vestibule gream,SetLightColor,5
1060,1060,let's get their paty o lifes to bebue,SetLightColor,5
1061,1061,let's lower the light please,DecreaseBrightness,3
1062,1062,let's make the entranslating red,SetLightColor,5
1063,1063,let's make the lights pink,SetLightColor,5
1064,1064,and you change t lighting into bathroom,SwitchLightOff,0
1065,1065,it' turn off the light in the office,SwitchLightOff,0
1066,1066,light up the vestibule,SwitchLightOn,1
1067,1067,titing needs to be aggested to level doing the cubicale,SetLightBrightness,4
1068,1068,lights in the backyard should be red,SetLightColor,5
1069,1069,light in the kid's bedroom must be onplese,SwitchLightOn,1
1070,1070,might more intent please,IncreaseBrightness,2
1071,1071,lights off in the living room,SwitchLightOff,0
1072,1072,lights off please,SwitchLightOff,0
1073,1073,lights off,SwitchLightOff,0
1074,1074,lights on in the kid's bedroom please,SwitchLightOn,1
1075,1075,can you change e lighting intensity of the laundy room to twenty two,SetLightBrightness,4
1076,1076,lights on now,SwitchLightOn,1
1077,1077,lates out,SwitchLightOff,0
1078,1078,lights out please,SwitchLightOff,0
1079,1079,lights out please,SwitchLightOff,0
1080,1080,lower all of the lighting,DecreaseBrightness,3
1081,1081,lower a brightness,DecreaseBrightness,3
1082,1082,lower greatness in the backyard,DecreaseBrightness,3
1083,1083,lower brightness in the toilet's room,DecreaseBrightness,3
1084,1084,lower light brightness,DecreaseBrightness,3
1085,1085,lower lighting in the back yard,DecreaseBrightness,3
1086,1086,can you change the lights to fifty on the pacio,SetLightBrightness,4
1087,1087,lower the brightness,DecreaseBrightness,3
1088,1088,lower the brightness in the cubicle,DecreaseBrightness,3
1089,1089,o'er the brightness in the pusoli's room,DecreaseBrightness,3
1090,1090,lower the brightness in the garden,DecreaseBrightness,3
1091,1091,lower the intensity of the lights,DecreaseBrightness,3
1092,1092,lower the lighting and the garage,DecreaseBrightness,3
1093,1093,lower it delights,DecreaseBrightness,3
1094,1094,o er thelights in my bedroom please,DecreaseBrightness,3
1095,1095,oer the light in the changing room,DecreaseBrightness,3
1096,1096,the brightness should be ten in a bathroom,SetLightBrightness,4
1097,1097,could you set te bath for brightness level to thirty nine,SetLightBrightness,4
1098,1098,the bold should not be so bright,DecreaseBrightness,3
1099,1099,the cellar light should be turned on,SwitchLightOn,1
1100,1100,the cellar needs to be bregter,IncreaseBrightness,2
1101,1101,the colar of the light should be pink in the toilet's room,SetLightColor,5
1102,1102,their cubical lights shall be pink,SetLightColor,5
1103,1103,that i nin o mes too brad,DecreaseBrightness,3
1104,1104,the garriage lightes me to be brigter,IncreaseBrightness,2
1105,1105,the grant should have its lights toned off now,SwitchLightOff,0
1106,1106,the house room might needs to be changed to red,SetLightColor,5
1107,1107,the kitchen leght should be pink,SetLightColor,5
1108,1108,e just a bedroom lights to ten per cent,SetLightBrightness,4
1109,1109,can you sed the backroom ligke to seventy three,SetLightBrightness,4
1110,1110,the kitchen should be brighter pleased,IncreaseBrightness,2
1111,1111,the large meeting room is too dark and must be made brighter,IncreaseBrightness,2
1112,1112,the laundry room is too bright,DecreaseBrightness,3
1113,1113,the loger room lights should be green,SetLightColor,5
1114,1114,the light color in the waiting room should be green,SetLightColor,5
1115,1115,the light in the apartment used to be dimmed,DecreaseBrightness,3
1116,1116,the light in the fordroom eans to be at seventy three,SetLightBrightness,4
1117,1117,the light in the parking lot should be pink,SetLightColor,5
1118,1118,the light in the shade neath the b alf,SwitchLightOff,0
1119,1119,the lights need to be dammed,DecreaseBrightness,3
1120,1120,th only said the badpost ofelinte riest,SetLightBrightness,4
1121,1121,the light needs to be dimmed,DecreaseBrightness,3
1122,1122,the lights are too bright and i want it dimmed,DecreaseBrightness,3
1123,1123,the lights in the cellar need to be turned up,IncreaseBrightness,2
1124,1124,the lights in the groging could be switched off,SwitchLightOff,0
1125,1125,the light in the cates pedroom are to dark,IncreaseBrightness,2
1126,1126,the lights in the living room needtably blue,SetLightColor,5
1127,1127,the lights in the living room should be on twenty two,SetLightBrightness,4
1128,1128,the light should be on please,SwitchLightOn,1
1129,1129,lo are the lighvts in the dining room,DecreaseBrightness,3
1130,1130,can you change the lights to green,SetLightColor,5
1131,1131,flower the lights on the patio,DecreaseBrightness,3
1132,1132,lo whot of the lades to gwinby,SetLightBrightness,4
1133,1133,oh delight,DecreaseBrightness,3
1134,1134,mag i dismens to les yo will be alli din to bred,SetLightBrightness,4
1135,1135,make certain no lights are on in the bathroom,SwitchLightOff,0
1136,1136,make it a little brighter in the bedroom,IncreaseBrightness,2
1137,1137,make it a little liss darken here,IncreaseBrightness,2
1138,1138,make it a little less dark in the back yard,IncreaseBrightness,2
1139,1139,make it brighter,IncreaseBrightness,2
1140,1140,make a briter in here,IncreaseBrightness,2
1141,1141,can you change the lights to piqe,SetLightColor,5
1142,1142,could brie him in the changing room,IncreaseBrightness,2
1143,1143,mak git brighter in the changing room,IncreaseBrightness,2
1144,1144,make a brigter in the dining room,IncreaseBrightness,2
1145,1145,make it brighter in the large meeting room,IncreaseBrightness,2
1146,1146,make a brighter in the living room,IncreaseBrightness,2
1147,1147,make it brighter in the waiting room,IncreaseBrightness,2
1148,1148,ake a dork,SwitchLightOff,0
1149,1149,make it darken here,SwitchLightOff,0
1150,1150,make it dark in the changing room,SwitchLightOff,0
1151,1151,make it duck,SwitchLightOff,0
1152,1152,can you change the lives to pink everywhere,SetLightColor,5
1153,1153,make e dimmer an yeur,DecreaseBrightness,3
1154,1154,make it more dem,DecreaseBrightness,3
1155,1155,make it so that the light is pink,SetLightColor,5
1156,1156,make landyroom green,SetLightColor,5
1157,1157,make laundry in light brightness twenty,SetLightBrightness,4
1158,1158,make lights brighter,IncreaseBrightness,2
1159,1159,make light dimmer,DecreaseBrightness,3
1160,1160,make lights less bright in the laundring room,DecreaseBrightness,3
1161,1161,make lates bink,SetLightColor,5
1162,1162,make lue lights of,SwitchLightOff,0
1163,1163,add more lighting in the basement,IncreaseBrightness,2
1164,1164,can you change the lights to the color red,SetLightColor,5
1165,1165,make my bolbs less bright,DecreaseBrightness,3
1166,1166,make my lights blue,SetLightColor,5
1167,1167,make my lights brighter,IncreaseBrightness,2
1168,1168,make my light sgreen,SetLightColor,5
1169,1169,make my lights pink,SetLightColor,5
1170,1170,make parking lights go on,SwitchLightOn,1
1171,1171,make sure the hollwelates are increased in breatness,IncreaseBrightness,2
1172,1172,make sure the light's braider so i can't see,IncreaseBrightness,2
1173,1173,make sure there are no lights on,SwitchLightOff,0
1174,1174,make t back air at brotor,IncreaseBrightness,2
1175,1175,can you change the patio ligte to blue,SetLightColor,5
1176,1176,make the basement at ten per cent for the light setting,SetLightBrightness,4
1177,1177,make the recent lights go on,SwitchLightOn,1
1178,1178,nake the by tru lade dimmer,DecreaseBrightness,3
1179,1179,tomake the bathroom lights on,SwitchLightOn,1
1180,1180,make the bedroom light demot,DecreaseBrightness,3
1181,1181,make the bedroom lights turn on,SwitchLightOn,1
1182,1182,make the bedroom light intensity ten,SetLightBrightness,4
1183,1183,make the boardroom light to twelve,SetLightBrightness,4
1184,1184,make the boardroom lights read,SetLightColor,5
1185,1185,make the brightness at twelve per cent,SetLightBrightness,4
1186,1186,can you train the besta ble to rit,SetLightColor,5
1187,1187,make the brightness in the kitchen seventy three,SetLightBrightness,4
1188,1188,make the brightness of my lights thirty nine,SetLightBrightness,4
1189,1189,make the brights of the lights be at least two per cent,SetLightBrightness,4
1190,1190,make the color of the light pink,SetLightColor,5
1191,1191,make the color of the light red,SetLightColor,5
1192,1192,makes a cubicle less bright,DecreaseBrightness,3
1193,1193,make the cubica light gream,SetLightColor,5
1194,1194,make the cupical lighting to be dimmer,DecreaseBrightness,3
1195,1195,make the cubical lights turn off,SwitchLightOff,0
1196,1196,can you darken the bedroom,DecreaseBrightness,3
1197,1197,make dining revites awf please,SwitchLightOff,0
1198,1198,make the yentery flat brighter,IncreaseBrightness,2
1199,1199,make the entrance light at twenty two,SetLightBrightness,4
1200,1200,make the entrance lights left tents,DecreaseBrightness,3
1201,1201,make the gadis read,SetLightColor,5
1202,1202,make the kit's bedroom brighter with more light,IncreaseBrightness,2
1203,1203,make the kild's bedroom light read,SetLightColor,5
1204,1204,make the kid's bedroom lights ea twelve,SetLightBrightness,4
1205,1205,make the gitroom braider,IncreaseBrightness,2
1206,1206,make the kitchen brighter,IncreaseBrightness,2
1207,1207,can you decree the brightness,DecreaseBrightness,3
1208,1208,make the large meeting room lage to thirteen anbreatnas,SetLightBrightness,4
1209,1209,make the laundry room a bit dark o please,DecreaseBrightness,3
1210,1210,make the laundry room lights red,SetLightColor,5
1211,1211,make the late bredarpence,IncreaseBrightness,2
1212,1212,make the light bult grit a please,IncreaseBrightness,2
1213,1213,make the light bulls in the pantry the twenty brightness,SetLightBrightness,4
1214,1214,make the lipebulbs pink,SetLightColor,5
1215,1215,make the light demer,DecreaseBrightness,3
1216,1216,make the light green,SetLightColor,5
1217,1217,make the light in the bathroom brighter,IncreaseBrightness,2
1218,1218,can ye decrease the brightness in the kid's bedroom,DecreaseBrightness,3
1219,1219,make the light in the bedroom brighter,IncreaseBrightness,2
1220,1220,make the ligt in the dining room red,SetLightColor,5
1221,1221,make the light in the pantry to two,SetLightBrightness,4
1222,1222,make the light turn red,SetLightColor,5
1223,1223,make delighting brdywin here,IncreaseBrightness,2
1224,1224,make the lighting brighter in the living room,IncreaseBrightness,2
1225,1225,make the lighting more intense in the bathroom,IncreaseBrightness,2
1226,1226,make the lights a little brighter in the laundry room,IncreaseBrightness,2
1227,1227,make the lights blue,SetLightColor,5
1228,1228,make the lights glue,SetLightColor,5
1229,1229,can you decrease the brightness of the lightbolt,DecreaseBrightness,3
1230,1230,make the lights blue,SetLightColor,5
1231,1231,make the lights brighter,IncreaseBrightness,2
1232,1232,make the lights brighter in the studio,IncreaseBrightness,2
1233,1233,make the lights brighter,IncreaseBrightness,2
1234,1234,make a light stimmer please,DecreaseBrightness,3
1235,1235,make the lights five,SetLightBrightness,4
1236,1236,make the lights go on,SwitchLightOn,1
1237,1237,make the lights green,SetLightColor,5
1238,1238,make the lights green please,SetLightColor,5
1239,1239,make the lights in the bedroom less bright,DecreaseBrightness,3
1240,1240,can you decrease the light intensity,DecreaseBrightness,3
1241,1241,make the livhes in the cellar at the too brightness,SetLightBrightness,4
1242,1242,make de lights seem to get it to thirty ninth louse,SetLightBrightness,4
1243,1243,make the lights in the house brighter,IncreaseBrightness,2
1244,1244,make the lights in the kid's room ten,SetLightBrightness,4
1245,1245,make the light in the kitchsbedroom green,SetLightColor,5
1246,1246,make the lights in the room lower,DecreaseBrightness,3
1247,1247,make the lights in the studio to be at twelve,SetLightBrightness,4
