,transcript,user_action
946,i'd like the living room lights to be at twelve percent percent,SetLightBrightness
947,would like the parking tad turned,SetLightColor
948,i'd like the vestibule lighting to be at thirty nine,SetLightBrightness
949,i'd like to activate lights in my cubicle,SwitchLightOn
950,like to have pink lighting in the bathroom,SetLightColor
951,would like to lights to be green please,SetLightColor
952,i'd like to lower the lights in the bedroom,DecreaseBrightness
953,can the lights be area instead.,SetLightColor
954,i'd prefer prefer the lights were on now,SwitchLightOn
955,i'd prefer it to be brighter,IncreaseBrightness
956,i'd prefer the from light to be at thirty nine,SetLightBrightness
957,prefer the laundry of lights to be turned to green,SetLightColor
958,i'd prefer the lights to be on,SwitchLightOn
959,rid prefer the office lights to be on,SwitchLightOn
960,i'd prefer the toilet lighting to be at level cella,SetLightBrightness
961,i'd one with the lights in the dining room,SwitchLightOff
962,I'm in the basement please turn the lights on,SwitchLightOn
963,I'm in the kitchen and need some lights,SwitchLightOn
964,can the living room lights be turned off,SwitchLightOff
965,I'm in the kitchen can you give me some lights please,SwitchLightOn
966,illuminate the entrance,SwitchLightOn
967,in the basement turned the brightness to twenty,SetLightBrightness
968,in the bathroom turn up the light power,IncreaseBrightness
969,in the changing room turned down the light power,DecreaseBrightness
970,can the cubicle and switch off the lights,SwitchLightOff
971,in the entrance changed the cellar to red,SetLightColor
972,in the entrance make the lights pink,SetLightColor
973,in the garage changed the lights to pink,SetLightColor
974,in the it's bedroom make the flat pink,SetLightColor
975,and were changed the house lighting to twelve,SetLightBrightness
976,in the kids bedroom turned the lights off,SwitchLightOff
977,in the laundry room turned down the light power,DecreaseBrightness
978,in the living room make the lights green,SetLightColor
979,in the lounge change it to level two,SetLightBrightness
980,in the lounge turned the lights off,SwitchLightOff
981,in the pantry turned down the brightness,DecreaseBrightness
982,in the pantry turn up the brightness,IncreaseBrightness
983,in the small meeting room the lights must be pink,SetLightColor
984,and the cellar set the brightness of the light cold to twelve,SetLightBrightness
985,increased brightness please,IncreaseBrightness
986,can we change Will lights to anything but pink,SetLightColor
987,increase brightness to fifty,SetLightBrightness
988,increase brightness to seventy-three tree,SetLightBrightness
989,bring rid brighness,IncreaseBrightness
990,increase light intensity,IncreaseBrightness
991,increase lighting in entire appartment,IncreaseBrightness
992,increase lighter in small meeting room,IncreaseBrightness
993,increase lights in entire house,IncreaseBrightness
994,increase the brighness in the changing room,IncreaseBrightness
995,increased the brightness of the basement,IncreaseBrightness
996,increased the brightness of the kitchen lights,IncreaseBrightness
997,can we make the whole house at twenty two,SetLightBrightness
998,increase the brighness of the flat in the cellar,IncreaseBrightness
999,increase the brightness of the flat in the dining room,IncreaseBrightness
1000,increase the brightness of the light in the entrance,IncreaseBrightness
1001,increase the brightness of the lights,IncreaseBrightness
1002,increase the brightness of this room,IncreaseBrightness
1003,increase the brightness to seventy-three tree,SetLightBrightness
1004,increase the brightness to ten,SetLightBrightness
1005,Place the cubicle's light intensity,IncreaseBrightness
1006,increased the intensity of the lighting,IncreaseBrightness
1007,is the intensity of the living sleep,IncreaseBrightness
1008,green light in the shed,SetLightColor
1009,increased the intensity of the flat,IncreaseBrightness
1010,red in changing room,IncreaseBrightness
1011,increase the light intensity,IncreaseBrightness
1012,increase the light intensity in the vestibule,IncreaseBrightness
1013,increase the lighting,IncreaseBrightness
1014,increased lighting in the cubicle,IncreaseBrightness
1015,intense the lighting in the vestibule,IncreaseBrightness
1016,increase the lighting intensity,IncreaseBrightness
1017,increase the lighting intensity please,IncreaseBrightness
1018,increase the lights in the bedroom,IncreaseBrightness
1019,activate that Let's light,SwitchLightOn
1020,can you change the bathroom light blue,SetLightColor
1021,increase the flat in the garden,IncreaseBrightness
1022,increase the flat in the toilet,IncreaseBrightness
1023,in increase lights on the patio,IncreaseBrightness
1024,increase the flat sleep,IncreaseBrightness
1025,increase the lights it is too dark,IncreaseBrightness
1026,is it possible to turn down the brightness,DecreaseBrightness
1027,is it the for you to decrease the brightness of the lights,DecreaseBrightness
1028,is it possible for you to turn the lights up in the cellar for us,IncreaseBrightness
1029,is it possible to get the lounge brightness to five,SetLightBrightness
1030,is it possible to stand down the brighness in the kitchen,DecreaseBrightness
1031,can you change the color of the lights to area in the lounge getting room,SetLightColor
1032,is it possible to turn on studio light,SwitchLightOn
1033,is it possible to turn the lights on,SwitchLightOn
1034,is it possible to turn the lights down in this room,DecreaseBrightness
1035,is there way to turn the kitchen lights to red,SetLightColor
1036,is there any you can change the light two be blue,SetLightColor
1037,it is too dark on the patio increase the lights,IncreaseBrightness
1038,it is two dark more lights,IncreaseBrightness
1039,it's to bright in here,DecreaseBrightness
1040,it's too bright bring the lights down,DecreaseBrightness
1041,too bright please make it darker,DecreaseBrightness
1042,the you change its in to,SetLightColor
1043,it's too dark in here,IncreaseBrightness
1044,it's too dark in here brightened the lights bit,IncreaseBrightness
1045,too dark in the bedroom,IncreaseBrightness
1046,too dark in the waiting room,IncreaseBrightness
1047,as way Throughout darken here,IncreaseBrightness
1048,Will the bathroom,SwitchLightOff
1049,Will the lights in the bedroom,SwitchLightOff
1050,Will the like in the entire appartment,SwitchLightOff
1051,let can brightness for me,DecreaseBrightness
1052,vestibule the brightness of the lights in the bedroom,DecreaseBrightness
1053,can you change the light in the garden to pink,SetLightColor
1054,let there be light,SwitchLightOn
1055,flat the garage meeting ten enter,SetLightBrightness
1056,let's have studio lights,SetLightColor
1057,let's have the entrance be area,SetLightColor
1058,let all the intensity of the lights,DecreaseBrightness
1059,let make the vestibule area,SetLightColor
1060,let's get the patio if to blue,SetLightColor
1061,let's lower the light please,DecreaseBrightness
1062,let's make the entrance rid,SetLightColor
1063,let's make the light pink,SetLightColor
1064,and you change the lighting into bathroom,SwitchLightOff
1065,it's turn off the like in the office,SwitchLightOff
1066,light up the vestibule,SwitchLightOn
1067,waiting needs to be adjusted to level do in the cubicle,SetLightBrightness
1068,lights in the backyard should be red,SetLightColor
1069,light in the kids bedroom must be on please,SwitchLightOn
1070,enter please,IncreaseBrightness
1071,lights off in the living room,SwitchLightOff
1072,lights Help please,SwitchLightOff
1073,like off,SwitchLightOff
1074,lights on in the kids bedroom please,SwitchLightOn
1075,can you change the lighting intensity of the laundry room to twenty two,SetLightBrightness
1076,lights on now,SwitchLightOn
1077,flat out,SwitchLightOff
1078,lights out please,SwitchLightOff
1079,lights out please,SwitchLightOff
1080,lower all of the lighting,DecreaseBrightness
1081,lower brightness,DecreaseBrightness
1082,lower brightness in the backyard,DecreaseBrightness
1083,lower brightness in the toilet room,DecreaseBrightness
1084,lower light brightness,DecreaseBrightness
1085,lower lighting in the backyard yard,DecreaseBrightness
1086,can you change the lights to fifty on the patio,SetLightBrightness
1087,lower the brightness,DecreaseBrightness
1088,lower the brightness in the cubicle,DecreaseBrightness
1089,here the brightness in the light's room,DecreaseBrightness
1090,lower the brightness in the garden,DecreaseBrightness
1091,lower the intensity of the lights,DecreaseBrightness
1092,lower the lighting and the garage,DecreaseBrightness
1093,lower it lights,DecreaseBrightness
1094,no here lights in my bedroom please,DecreaseBrightness
1095,over the light in the changing room,DecreaseBrightness
1096,the brightness should be ten in bathroom,SetLightBrightness
1097,could you set the that room brightness level to thirty nine,SetLightBrightness
1098,the bulbs should not be so bright,DecreaseBrightness
1099,the cellar light should be turned on,SwitchLightOn
1100,the cellar needs to be brighter,IncreaseBrightness
1101,the cellar of the light should be pink in the toilet room,SetLightColor
1102,the cubicle lights all be pink,SetLightColor
1103,that dining room less too tad,DecreaseBrightness
1104,the garage flat me to be brighter,IncreaseBrightness
1105,the want should have its light one off now,SwitchLightOff
1106,the house room light needs to be changed to red,SetLightColor
1107,the kitchen light should be pink,SetLightColor
1108,at just the bedroom lights the ten percent percent,SetLightBrightness
1109,can you set the room light to seventy-three,SetLightBrightness
1110,the kitchen should be brighter please,IncreaseBrightness
1111,the large meeting room is too dark and must be made brighter,IncreaseBrightness
1112,the laundry room is too bright,DecreaseBrightness
1113,the lower room these should be green,SetLightColor
1114,the light color in the waiting room should be green,SetLightColor
1115,the light in the appartment meeting to be dimmed,DecreaseBrightness
1116,the light in the boardroom house to be at seventy-three tree,SetLightBrightness
1117,the light in the parking lot should be pink,SetLightColor
1118,the light in the made need to the,SwitchLightOff
1119,the lights need to be dimmed,DecreaseBrightness
1120,ten the rid the Boost twenty trip,SetLightBrightness
1121,the light needs to be dimmed,DecreaseBrightness
1122,lights are too bright and want it dim,DecreaseBrightness
1123,the lights in the cellar need to be turned up,IncreaseBrightness
1124,the lights in the changing could be switched off,SwitchLightOff
1125,the light in toilet are to dark on,IncreaseBrightness
1126,the lights in the living room need to blue,SetLightColor
1127,the lights in the living room should be on twenty two,SetLightBrightness
1128,the light should be on please,SwitchLightOn
1129,loo are the made in that one them,DecreaseBrightness
1130,can you change the lights to green,SetLightColor
1131,lower the lights on the patio,DecreaseBrightness
1132,no what of the made to twenty,SetLightBrightness
1133,light,DecreaseBrightness
1134,make small to us you be all in to cella,SetLightBrightness
1135,make certain no lights are on in the bathroom,SwitchLightOff
1136,make it little brighter in the bedroom,IncreaseBrightness
1137,make it little is darken here,IncreaseBrightness
1138,make it little less dark in the backyard yard,IncreaseBrightness
1139,make it brighter,IncreaseBrightness
1140,Place rid in here,IncreaseBrightness
1141,can you change the lights to pink,SetLightColor
1142,could Dim in the changing room,IncreaseBrightness
1143,make it brighter in the changing room,IncreaseBrightness
1144,make rid in the dining room,IncreaseBrightness
1145,make it brighter in the large meeting room,IncreaseBrightness
1146,be brighter in the living room,IncreaseBrightness
1147,make it brighter in the waiting room,IncreaseBrightness
1148,Click do,SwitchLightOff
1149,make it darken here,SwitchLightOff
1150,make it dark in the changing room,SwitchLightOff
1151,make it Reduce,SwitchLightOff
1152,can you change to pink everywhere,SetLightColor
1153,make here dimmer in turn,DecreaseBrightness
1154,make it more them,DecreaseBrightness
1155,make it so that the light is pink,SetLightColor
1156,make roomcan green,SetLightColor
1157,make laundry in light brightness twenty,SetLightBrightness
1158,make lights brighter,IncreaseBrightness
1159,make light dimmer,DecreaseBrightness
1160,make lights less bright in the laundry room,DecreaseBrightness
1161,flat pink,SetLightColor
1162,make blue lights of,SwitchLightOff
1163,tad more lighting in the basement,IncreaseBrightness
1164,can you change the lights to the color red,SetLightColor
1165,make my bulbs less bright,DecreaseBrightness
1166,make my lights blue,SetLightColor
1167,make my lights brighter,IncreaseBrightness
1168,make my lights green,SetLightColor
1169,make my lights pink,SetLightColor
1170,make parking lights go on,SwitchLightOn
1171,make sure the flat are increased in brightness,IncreaseBrightness
1172,make sure the lights Make so can see,IncreaseBrightness
1173,make sure there are no lights on,SwitchLightOff
1174,make the backyard red go,IncreaseBrightness
1175,can you change the patio light to blue,SetLightColor
1176,make the basement at ten percent percent for the light setting,SetLightBrightness
1177,make the Lessen lights go on,SwitchLightOn
1178,make the balcony tree tad be,DecreaseBrightness
1179,to make the bathroom light on,SwitchLightOn
1180,make the bedroom light not,DecreaseBrightness
1181,make the bedroom lights turn on,SwitchLightOn
1182,make the bedroom light intense be ten,SetLightBrightness
1183,make the boardroom light to twelve,SetLightBrightness
1184,make the boardroom room lights red,SetLightColor
1185,make the brightness at twelve percent percent,SetLightBrightness
1186,can you change the be able to it,SetLightColor
1187,make the brightness in the kitchen seventy-three tree,SetLightBrightness
1188,make the brightness of my lights thirty nine,SetLightBrightness
1189,make the bright of the lights be at please two percent percent,SetLightBrightness
1190,make the color of the light pink,SetLightColor
1191,make the color of the light red,SetLightColor
1192,make the cubicle less bright,DecreaseBrightness
1193,make the cubicle light green,SetLightColor
1194,make the cubicle lighting to be dimmer,DecreaseBrightness
1195,make the cubicle lights turn off,SwitchLightOff
1196,can you darken the bedroom,DecreaseBrightness
1197,make dining room lit flick,SwitchLightOff
1198,make the enter flat brighter,IncreaseBrightness
1199,make the entrance light at twenty two,SetLightBrightness
1200,make the entrance lights let enter,DecreaseBrightness
1201,make the made,SetLightColor
1202,make the it's bedroom brighter with more light,IncreaseBrightness
1203,make the child's bedroom light area,SetLightColor
1204,make the kids bedroom lights area twelve,SetLightBrightness
1205,make the room made,IncreaseBrightness
1206,make the kitchen brighter,IncreaseBrightness
1207,can you decrease the brightness,DecreaseBrightness
1208,make the large meeting room large to ten can but create,SetLightBrightness
1209,make the laundry room bit please,DecreaseBrightness
1210,make the laundry room lights red,SetLightColor
1211,make the flat dark,IncreaseBrightness
1212,make the flat bulb create please,IncreaseBrightness
1213,make the light all in the pantry the twenty brightness,SetLightBrightness
1214,make the lightbulb pink,SetLightColor
1215,make the light dimmer,DecreaseBrightness
1216,make the light green,SetLightColor
1217,make the light in the bathroom brighter,IncreaseBrightness
1218,can the decrease the brightness in the kids bedroom,DecreaseBrightness
1219,make the light in the bedroom brighter,IncreaseBrightness
1220,make the it in the dining room red,SetLightColor
1221,make the light in the pantry too too,SetLightBrightness
1222,make the light turn red,SetLightColor
1223,make lighting bring here,IncreaseBrightness
1224,made the lighting brighter in the living room,IncreaseBrightness
1225,make the lighting more intense in the bathroom,IncreaseBrightness
1226,make the lights little brighter in the laundry room,IncreaseBrightness
1227,make the lights blue,SetLightColor
1228,make the lights blue,SetLightColor
1229,can you decrease the brightness of the flipped,DecreaseBrightness
1230,make the lights blue,SetLightColor
1231,make the lights brighter,IncreaseBrightness
1232,make the lights brighter in the studio,IncreaseBrightness
1233,make the lights brighter,IncreaseBrightness
1234,make light dimmer please,DecreaseBrightness
1235,make the lights five,SetLightBrightness
1236,make the lights go on,SwitchLightOn
1237,make the lights green,SetLightColor
1238,make the lights green please,SetLightColor
1239,make the lights in the bedroom less bright,DecreaseBrightness
1240,can you decrease the light intensity,DecreaseBrightness
1241,make the five in the cellar at the too brightness,SetLightBrightness
1242,made the lights see the at ten thirty nine house,SetLightBrightness
1243,make the lights in the house brighter,IncreaseBrightness
1244,make the lights in the kids room ten,SetLightBrightness
1245,make the light in the bedroom green,SetLightColor
1246,make the lights in the room lower,DecreaseBrightness
1247,make the lights in the studio to be at twelve,SetLightBrightness
1248,make the lights in the toilet brighter,IncreaseBrightness
1249,make the if less bright,DecreaseBrightness
1250,can you give the lights in the lounge,DecreaseBrightness
1251,make the lights less bright,DecreaseBrightness
1252,make the lights more bright,IncreaseBrightness
1253,make the lights more bright in the bedroom,IncreaseBrightness
1254,make the lights not shine any more,SwitchLightOff
1255,make the light pink,SetLightColor
1256,make the flat pink,SetLightColor
1257,make the lights red,SetLightColor
1258,make the large of the color area,SetLightColor
1259,make the lights turn off,SwitchLightOff
1260,make light turn off in the waiting room,SwitchLightOff
1261,can you increase the brightness of the lights in the bedroom,IncreaseBrightness
1262,make the flat turn on,SwitchLightOn
1263,make the living room dimmer,DecreaseBrightness
1264,Make the living room light on,DecreaseBrightness
1265,make the lounge twenty two,SetLightBrightness
1266,make meeting room flat fifty,SetLightBrightness
1267,make the pantry five percent percent in brightness,SetLightBrightness
1268,make the pantry lights to twelve,SetLightBrightness
1269,make the patio brighter,IncreaseBrightness
1270,make the room bit darker,DecreaseBrightness
1271,make the room brighter,IncreaseBrightness
1272,at just brightness to fifty,SetLightBrightness
1273,can you increase the brightness,IncreaseBrightness
1274,make the studio lighting to be at the twelve setting,SetLightBrightness
1275,make the studio light off,SwitchLightOff
1276,make the toilet green lights,SetLightColor
1277,make twenty two the brightness instead.,SetLightBrightness
1278,way you change the like in please,SetLightColor
1279,more light please,IncreaseBrightness
1280,more lights please,IncreaseBrightness
1281,cold bright setting in the dining room entire,SetLightBrightness
1282,my bedroom needs to be darker,DecreaseBrightness
1283,no lights in the garden,SwitchLightOff
1284,can all after lightening level in the studio,IncreaseBrightness
1285,value cut out lights in the pantry,SwitchLightOff
1286,"Make google, turn off lights can entire flat",SwitchLightOff
1287,"google, turn off lights",SwitchLightOff
1288,Once you enter the laundry room turn on the lights,SwitchLightOn
1289,please turn on the light,SwitchLightOn
1290,Place the cellar lights in the off position,SwitchLightOff
1291,Place the lighting on level twenty two in the possible,SetLightBrightness
1292,please activate the lights,SwitchLightOn
1293,please just the cubicle light so its brighter,IncreaseBrightness
1294,please adjust the light brightness to go lower please,DecreaseBrightness
1295,can you light up the basement bit more,IncreaseBrightness
1296,please adjust the light bulbs to twelve,SetLightBrightness
1297,please brightened the lights in the meeting room,IncreaseBrightness
1298,please change entrance lights to blue,SetLightColor
1299,please change the lights to area and nine,SetLightColor
1300,please change the brightness in the room,DecreaseBrightness
1301,please changed the brightness level in parking area to twenty,SetLightBrightness
1302,please change the brightness level in the backyard yard to fifty,SetLightBrightness
1303,please changing the color in the large meeting room to pink,SetLightColor
1304,please can the color of the flat rid,SetLightColor
1305,please change the color to pink,SetLightColor
1306,can you make it tad brighter please,IncreaseBrightness
1307,please change the cold to area in the bathroom,SetLightColor
1308,please changed light color in the kitchen to blue,SetLightColor
1309,please change the lighting to twelve in one shed,SetLightBrightness
1310,please change the light green,SetLightColor
1311,please can the lights in them waiting room for rid can is,SetLightColor
1312,please change lights to area in the cellar,SetLightColor
1313,Place changed the lights to red,SetLightColor
1314,please change the lights to twenty two in the house,SetLightBrightness
1315,vestibule the living room made red,SetLightColor
1316,please cut off all light,SwitchLightOff
1317,can you Make it brighter inside,IncreaseBrightness
1318,please decrease the brightness,DecreaseBrightness
1319,please decrease the brightness,DecreaseBrightness
1320,please dim light,DecreaseBrightness
1321,please dim the lights,DecreaseBrightness
1322,please flick the lights on,SwitchLightOn
1323,please get rid of the lights,SwitchLightOff
1324,please get the lights off,SwitchLightOff
1325,please go on and increase the brightness,IncreaseBrightness
1326,please have the waiting room be less bright,DecreaseBrightness
1327,please increase lights,IncreaseBrightness
1328,can you make it dimmer and here,DecreaseBrightness
1329,please increase the brightness of the lights,IncreaseBrightness
1330,please increase the brightness of the lights in the kids room,IncreaseBrightness
1331,please increase the brightness of the lights in the small meeting room,IncreaseBrightness
1332,please increase the brighness of the flat,IncreaseBrightness
1333,please increase the garage,IncreaseBrightness
1334,please increase the meeting,IncreaseBrightness
1335,please increase lights in the office,IncreaseBrightness
1336,these will area the brightness for me,DecreaseBrightness
1337,please lower the lights in the room,DecreaseBrightness
1338,please lower the lights,DecreaseBrightness
1339,can you make the bedroom lights go up,IncreaseBrightness
1340,please make it brighter,IncreaseBrightness
1341,please make the color red,SetLightColor
1342,please make the want flat blue,SetLightColor
1343,please make the flat room blue,SetLightColor
1344,please make the light let,SetLightColor
1345,please make to light red,SetLightColor
1346,please make the lights brighter,IncreaseBrightness
1347,please make the flat green,SetLightColor
1348,please make the light green in the dining room,SetLightColor
1349,please make the flat pink,SetLightColor
1350,can you make the brightness twelve,SetLightBrightness
1351,please make lights pink in my bedroom,SetLightColor
1352,please make the vestibule lighting to be at twelve,SetLightBrightness
1353,please put off the pantry,SwitchLightOff
1354,please set it two five,SetLightBrightness
1355,please at lounge brightness at twenty percent,SetLightBrightness
1356,the rid the nine make ten to nine,SetLightBrightness
1357,please rid the brightness to five percent,SetLightBrightness
1358,please at the light brightness level of basement to thirty nine,SetLightBrightness
1359,the serial the rid cold to change,SetLightBrightness
1360,please set the office lights down,DecreaseBrightness
1361,can you make the lights blue,SetLightColor
1362,please set the office to twenty two for the intensity,SetLightBrightness
1363,please set the studio to level too for the light intensity,SetLightBrightness
1364,please set the toilet lighting to two,SetLightBrightness
1365,shed rid the toilet room like to too,SetLightBrightness
1366,please shut off the lighting,SwitchLightOff
1367,please shut off the lights above the toilet,SwitchLightOff
1368,please shut off the lights,SwitchLightOff
1369,please stop the lights,SwitchLightOff
1370,create switch my lights on cella,SwitchLightOn
1371,please switch on the lights for the facilities,SwitchLightOn
1372,can you make the light brighter,IncreaseBrightness
1373,Place child's on my cubicle if,SwitchLightOn
1374,please turn the lights,SwitchLightOn
1375,please area the color of the light to be red please,SetLightColor
1376,way switch to pink living,SetLightColor
1377,please to the green,SetLightColor
1378,less turned down the brightness,SwitchLightOff
1379,please turn down the light intensity,DecreaseBrightness
1380,please turn down the lights,DecreaseBrightness
1381,please turn down the lights and the entrance area,DecreaseBrightness
1382,please turn down the lights in the pantry,DecreaseBrightness
1383,don't just bedroom brightness level to seventy-three tree,SetLightBrightness
1384,can you make the light dimmer in the living room,DecreaseBrightness
1385,please turn light area in large meeting room,SetLightColor
1386,please turn lights up,IncreaseBrightness
1387,please turn my light on,SwitchLightOn
1388,please don't off all light,SwitchLightOff
1389,please turn off all lights,SwitchLightOff
1390,please turn off the cellar like,SwitchLightOff
1391,please turn off the lighting,SwitchLightOff
1392,please turn not the lighting,SwitchLightOff
1393,please turn off the lights in the bedroom,SwitchLightOff
1394,please turn off the lights in the bedroom,SwitchLightOff
