,transcript,user_action
478,turned off the light to turn,SetLightBrightness
479,turn on kitchen lights,SwitchLightOn
480,turn on the waiting room lights,SwitchLightOn
481,turn on the garden light,SwitchLightOn
482,brighter office,SwitchLightOn
483,the afternoon. the lights of there,SwitchLightOn
484,turn on the lights in the children room,SwitchLightOn
485,turn on the lights urgently,SwitchLightOn
486,don't too your light up,SwitchLightOn
487,Throughout the basement lights blue,SetLightColor
488,change the brightness to two,SetLightBrightness
489,bring to brighten us down,DecreaseBrightness
490,turn the garden lights to brightness too please,SetLightBrightness
491,turn the house light pink,SetLightColor
492,stand the tad down in the backyard,DecreaseBrightness
493,need the light down in the bedroom,DecreaseBrightness
494,turn the light down in the tad,DecreaseBrightness
495,turn the light down,DecreaseBrightness
496,can it off,SwitchLightOff
497,on the let trip,SetLightColor
498,turn the lights up,IncreaseBrightness
499,changed the bulbs to twelve set in brightness,SetLightBrightness
500,turned lights pink,SetLightColor
501,turn up light can basement,IncreaseBrightness
502,turn of light and let,IncreaseBrightness
503,turn up the brightness,IncreaseBrightness
504,turn up the brightness in the patio,IncreaseBrightness
505,can up the darkness in the studio,IncreaseBrightness
506,down at the flat in the ten,IncreaseBrightness
507,why is everywhere so dark the need to turn up the brightness,IncreaseBrightness
508,why is it so bright in here please turn it down notch,DecreaseBrightness
509,why is there are no lights in the waiting room turn it out please,IncreaseBrightness
510,changed the garage less to rid,SetLightColor
511,will you turn the brightness to level thirty nine,SetLightBrightness
512,change the color of the lights to blue in the dining room,SetLightColor
513,change the color of the lights to blue,SetLightColor
514,adjust the change of home. intensity of the lighting to two percent percent,SetLightBrightness
515,change the color of the flat to green,SetLightColor
516,is the color of the made to pink,SetLightColor
517,change the color to blue,SetLightColor
518,change the cellar to pink,SetLightColor
519,change the cubicle light sun to ten,SetLightBrightness
520,change the garage lights to Make,SetLightColor
521,change the kids bedroom light bulb cellar to green,SetLightColor
522,change the kitchen lights to green,SetLightColor
523,bring the can on serial into,SetLightColor
524,change the laundry room lights to green,SetLightColor
525,Lessen the glow of the bulb to level two,SetLightBrightness
526,in cellar red room red,SetLightColor
527,changed the light blue,SetLightColor
528,nine the light color to pink please,SetLightColor
529,change the light setting to on,SwitchLightOn
530,change the light to blue,SetLightColor
531,change the light to pink,SetLightColor
532,changed like to pink,SetLightColor
533,change the lighting of the pantry to thirty nine,SetLightBrightness
534,this the lighting to Dim,DecreaseBrightness
535,change lighting to fifty in the facilities,SetLightBrightness
536,Lessen the kids lighting to ten,SetLightBrightness
537,change the light's area,SetLightColor
538,change the lights in the child's bedroom to pink,SetLightColor
539,change the lights in the entrance to blue,SetLightColor
540,change the lights in the kids bedroom to blue,SetLightColor
541,changed the lights in the parking area to green,SetLightColor
542,change the lights in the parking room,SwitchLightOff
543,in the flat in the toilet green,SetLightColor
544,change the lights into blue,SetLightColor
545,change lights to green please,SetLightColor
546,change the with to pink please,SetLightColor
547,activate garden lights,SwitchLightOn
548,adjust the laundry room lighting to up thirty nine,SetLightBrightness
549,change the lights to pink,SetLightColor
550,change the lights to red,SetLightColor
551,change the lights to red in the parking section,SetLightColor
552,change the living room lights to twenty,SetLightBrightness
553,change the office light to pink,SetLightColor
554,changed office lights to of meeting,SetLightBrightness
555,changed parking room to green,SetLightColor
556,changed vestibule lighting to two percent percent,SetLightBrightness
557,change the yard lights to green,SetLightColor
558,change toilets light color to red,SetLightColor
559,adjust the lighting to level twenty two,SetLightBrightness
560,Click on the lights,SwitchLightOn
561,color change lights to red,SetLightColor
562,cold flat pink,SetLightColor
563,color lights red,SetLightColor
564,color the its all red,SetLightColor
565,color the light's red,SetLightColor
566,cold you change the brightness of the lights on the patio to seventy-three tree,SetLightBrightness
567,could you change the light to red,SetLightColor
568,could you increase the brightness of the lights,IncreaseBrightness
569,could you increase the light brightness in the dining room,IncreaseBrightness
570,just the light its less bright,DecreaseBrightness
571,could you make the lights in the basement brighter,IncreaseBrightness
572,could you please turn my lights on,SwitchLightOn
573,could you please turn the light on I'm some,SwitchLightOn
574,could you switch on some lights,SwitchLightOn
575,could you turn down the bedroom lights,DecreaseBrightness
576,could you turn the lights on please,SwitchLightOn
577,but of lowered with garden light,SwitchLightOff
578,cut the waiting room light,SwitchLightOff
579,dark in the waiting room,SwitchLightOff
580,decrease brightness,DecreaseBrightness
581,adjust lights to the setting,SwitchLightOff
582,the shed brightness in after room,DecreaseBrightness
583,decreased brightness in boardroom by one third.,DecreaseBrightness
584,decrease brightness please,DecreaseBrightness
585,the tree light brighness in little,DecreaseBrightness
586,decrease light brightness please,DecreaseBrightness
587,create lights in house,DecreaseBrightness
588,decreased the brightness,DecreaseBrightness
589,decreased the brightness of the bulbs,DecreaseBrightness
590,increased the brightness of lights can shed,DecreaseBrightness
591,adjust living room brightness to level too,SetLightBrightness
592,decrease the brightness please,DecreaseBrightness
593,decrease the intensity of the lights,DecreaseBrightness
594,decreased the intensity of the lights in the kids bedroom,DecreaseBrightness
595,decreased the intensity of the pantry waiting,DecreaseBrightness
596,decrease the light brightness in the cubicle,DecreaseBrightness
597,decreased light intensity,DecreaseBrightness
598,decreased light intensity in the entrance,DecreaseBrightness
599,decreased the light intensity in the entrance to zero,SwitchLightOff
600,decreased the light intensity in the office,DecreaseBrightness
601,decrease the light intensity in the vestibule to zero,SwitchLightOff
602,just pink you like to blue,SetLightColor
603,decrease the light intensity to zero,SwitchLightOff
604,decrease the lighting in the laundry room,DecreaseBrightness
605,decrease the lighting so it's not so bright,DecreaseBrightness
606,decrease the light's intensity in my bedroom balcony,DecreaseBrightness
607,dim lights please,DecreaseBrightness
608,can lights please,DecreaseBrightness
609,dim bathroom,DecreaseBrightness
610,dim the light in the it's bedroom,DecreaseBrightness
611,them the lighting completely in the waiting room,SwitchLightOff
612,dim the lights,DecreaseBrightness
613,i'd just the pantry lighting level thirty nine,SetLightBrightness
614,dim the lights completely in the living room,SwitchLightOff
615,dim the lights for me,DecreaseBrightness
616,dim the lights in the backyard,DecreaseBrightness
617,dim the lights in the bathroom,DecreaseBrightness
618,dim lights in the get,DecreaseBrightness
619,dim the lights in the living room,DecreaseBrightness
620,the the light's Place,DecreaseBrightness
621,can the lights please,DecreaseBrightness
622,dimmer,DecreaseBrightness
623,dim the studio lighting,DecreaseBrightness
624,adjust toilet lighting to the two setting,SetLightBrightness
625,do me here and sun the flat on,SwitchLightOn
626,do turn out on my bedroom light now,SwitchLightOn
627,don't forget to turn off the lights in the studio,SwitchLightOff
628,level light entrance from shining,SwitchLightOff
629,Eliminate the lighting,SwitchLightOff
630,and the lights from shining in the cubicle,SwitchLightOff
631,and sure the lights are off in the waiting room,SwitchLightOff
632,Find the bulbs for the cellar and turn them up,IncreaseBrightness
633,get me more light,IncreaseBrightness
634,get me some lights in the ten,SwitchLightOn
635,get the inside to at made do,SetLightBrightness
636,get rid of the lights in the bathroom,SwitchLightOff
637,get the cellar lights on,SwitchLightOn
638,get the lounge room lights up twenty two,SetLightBrightness
639,get the lights on,SwitchLightOn
640,get the lights on please,SwitchLightOn
641,Make the living room Situate on please,SwitchLightOn
642,get the room brighter please,IncreaseBrightness
643,give me more light can here,IncreaseBrightness
644,give me more flat in the bedroom,IncreaseBrightness
645,give me pink lights,SetLightColor
646,have just the toilets lights to twenty,SetLightBrightness
647,go ahead turn the tad meeting mood light the pink,SetLightColor
648,go ahead and turn the laundry room lights up brighter,IncreaseBrightness
649,go straight and turn on the lights,SwitchLightOn
650,go please shut off the lights,SwitchLightOff
651,"google, shut off lights",SwitchLightOff
652,have the kitchen five at lower brightness,DecreaseBrightness
653,over the lights colored blue,SetLightColor
654,have the lights turn blue,SetLightColor
655,help me change the color blue,SetLightColor
656,help me decrease the brightness in backyard there,DecreaseBrightness
657,activate lights,SwitchLightOn
658,level please turn off lights in backyard,SwitchLightOff
659,help me them the light in the pantry,DecreaseBrightness
660,help me in the lights,DecreaseBrightness
661,help me dim the lights Place,DecreaseBrightness
662,help me make it so light is not so bright,DecreaseBrightness
663,help me make the entire appartment area,SetLightColor
664,help me make the entire house pink,SetLightColor
665,help me make the light brighter,IncreaseBrightness
666,help me make the light green,SetLightColor
667,help me make the light red,SetLightColor
668,help me put on the lights,SwitchLightOn
669,are you able to change the lights to turn to green,SetLightColor
670,help me rid the bright to two,SetLightBrightness
671,house me set the entrance flat to two,SetLightBrightness
672,help me set the lights to fifty,SetLightBrightness
673,help me set the lights to twenty,SetLightBrightness
674,help me turn on the light please,SwitchLightOn
675,help me turn the flat on,SwitchLightOn
676,the cut the lights in the kitchen,SwitchLightOff
677,less get the light brightness lower here,DecreaseBrightness
678,don't prefer the living room lights to be on anymore,SwitchLightOff
679,don't want it to be so have,DecreaseBrightness
680,"Assistant, need my cubicle lights on",SwitchLightOn
681,don't want it to be this Make,DecreaseBrightness
682,don't want backyard yard lights to be on,SwitchLightOff
683,don't want the bedroom to be so bright,DecreaseBrightness
684,don't want the lights on any more,SwitchLightOff
685,don't want to lights in cella any more,SwitchLightOff
686,don't want the lights on,SwitchLightOff
687,don't want the lights to shine in the living room,SwitchLightOff
688,don't want there to be any light on in the office,SwitchLightOff
689,don't want there to be lights on any more,SwitchLightOff
690,need brightness setting of twelve in the can tree,SetLightBrightness
691,"Assistant, turned my lights on",SwitchLightOn
692,need brighter lighting in the bedroom,IncreaseBrightness
693,need it to be brighter and the cubicle,IncreaseBrightness
694,any waiting,SwitchLightOn
695,need lighting in the kitchen,SwitchLightOn
696,need light on over the toilets,SwitchLightOn
697,need more light,IncreaseBrightness
698,rid more light here,IncreaseBrightness
699,need my bedroom brighter now,IncreaseBrightness
700,need my bedroom lighter lower,DecreaseBrightness
701,need my pantry set at ten brightness,SetLightBrightness
702,want the brightness of lights,IncreaseBrightness
703,need lighting in the office,SetLightColor
704,need some light play,SwitchLightOn
705,made some light play in the kitchen,SwitchLightOn
706,and need some five,SwitchLightOn
707,need some lights in the kitchen,SwitchLightOn
708,need some more lights in here,IncreaseBrightness
709,need the cella balcony like turned off,SwitchLightOff
710,made the light,SwitchLightOn
711,need the light in the kitchen,SwitchLightOn
712,there like to be brighter,IncreaseBrightness
713,laundry want the brightness of the waiting room,IncreaseBrightness
714,need the like to be increased,IncreaseBrightness
715,need the lighting cranked up little,IncreaseBrightness
716,need the light Lessen like to if that room to be set at and meeting,SetLightBrightness
717,need the lights in the kids room to be pink,SetLightColor
718,one the flat near the facilities to be create,IncreaseBrightness
719,need the lights off in the changing room,SwitchLightOff
720,need the so in the entrance,SwitchLightOff
721,need lights to be blue now,SetLightColor
722,need the lights to be blue,SetLightColor
723,the lights to be brighter,IncreaseBrightness
724,but sure that all little living is off,SwitchLightOff
725,need lights to be dimmed,DecreaseBrightness
726,need the lights turn down bed,DecreaseBrightness
727,need the lights turned off in the vestibule,SwitchLightOff
728,the room to be blue,SetLightColor
729,need this Set to have the lighting more fifty,SetLightBrightness
730,need two lamps all off no,SwitchLightOff
731,stop the lights to be on,SwitchLightOff
732,can you raise the lights in the toilets,IncreaseBrightness
733,stop the lights,SwitchLightOff
734,switch all the lights to the off position in the vestibule,SwitchLightOff
735,switch flat double,SetLightColor
736,switch my lights on now,SwitchLightOn
737,switch all exterior lighting,SwitchLightOff
738,switch of small meeting room light,SwitchLightOff
739,switch of the garage light,SwitchLightOff
740,switch off the lights,SwitchLightOff
741,switch off the lights after level for the area,SwitchLightOff
742,switch off the shed lights,SwitchLightOff
743,can you set pink right in the basement,SetLightColor
744,switch on my backyard yard lighting,SwitchLightOn
745,switch on my cubicle light please,SwitchLightOn
746,switch on my garden lights,SwitchLightOn
747,switch the lights in the kids bedroom,SwitchLightOn
748,switch on the lights,SwitchLightOn
749,switch on the studio flat,SwitchLightOn
750,meeting the light to green,SetLightColor
751,switched the light green,SetLightColor
752,switched the lights the blue in the bedroom,SetLightColor
753,switch the lights to dark in the pantry,SwitchLightOff
754,can you red the basement lights to five,SetLightBrightness
755,shed the lit light to red,SetLightColor
756,switch to red lights,SetLightColor
757,turn on the lights of kids bedroom,SwitchLightOn
758,the basement is too bright,DecreaseBrightness
759,basement lights must be switched on,SwitchLightOn
760,the bedroom light are too bright but with the brightness,DecreaseBrightness
761,the bedroom lights need of brighter illumination,IncreaseBrightness
762,the bedroom lights need to be brighter right now,IncreaseBrightness
763,the brightness and the studio should be twenty two,SetLightBrightness
764,need do lamps all off now please,SwitchLightOff
765,need you to increase the intensity of the backyard light,IncreaseBrightness
766,need you to turn the lights off in the basement,SwitchLightOff
767,prefer it the lights are on now,SwitchLightOn
768,be sure the light intensity is set to two percent percent,SetLightBrightness
769,should like to see red lights,SetLightColor
770,think all the light should be on twenty two,SetLightBrightness
771,think the light should be on by now,SwitchLightOn
772,think the light should be pink,SetLightColor
773,want blue light,SetLightColor
774,want its,SetLightColor
775,want green light,SetLightColor
776,on at less brightened,DecreaseBrightness
777,want it pink in here,SetLightColor
778,want to be brighter in the cella,IncreaseBrightness
779,be sure the lights are completely darkened by the toilet,SwitchLightOff
780,want less brightness,DecreaseBrightness
781,want let lit,DecreaseBrightness
782,want less light in the waiting room,DecreaseBrightness
783,don't level twelve to be the setting for the brightness,SetLightBrightness
784,want lighting in the bedroom,SwitchLightOn
785,want lights,SwitchLightOn
786,want lights in the kitchen,SwitchLightOn
787,want if on in the backyard yard,SwitchLightOn
788,want lights on Place,SwitchLightOn
789,want living room lights to be changed to pink,SetLightColor
790,more ten like more off by the toilet,SwitchLightOff
791,want more brightness in the changing room,IncreaseBrightness
792,what more brightness that to pantry,IncreaseBrightness
793,want more light,IncreaseBrightness
794,don't more light in the bathroom,IncreaseBrightness
795,want my child's bedroom to have green like,SetLightColor
796,want my cubicle lights to be two,SetLightBrightness
797,want pink lights now,SetLightColor
798,want area lighting,SetLightColor
799,Will want red lights please,SetLightColor
800,want bathroom to be more in,DecreaseBrightness
801,trip made lights in the waiting room,SwitchLightOn
802,us ten brightness the lights,IncreaseBrightness
803,want the brightest lights in the kitchen Place,IncreaseBrightness
804,want the brightness of the lights in the laundry room to be fifty,SetLightBrightness
805,want the brightness rid to too,SetLightBrightness
806,and bright stop be fifty be room,SetLightBrightness
807,want the brightness to be level the on my light,SetLightBrightness
808,want the brightness to be set at twenty,SetLightBrightness
809,want to area this turn up in this room,IncreaseBrightness
810,want to cella here flat on,SwitchLightOn
811,want the cellar flat off,SwitchLightOff
812,bright lights entrance,IncreaseBrightness
813,want to cella here lights on,SwitchLightOn
814,want the cubicle lights to be at twenty two percent percent,SetLightBrightness
815,want the cubicle to be brighter,IncreaseBrightness
816,twenty to cubicle to be at thirty nine brightness,SetLightBrightness
817,want the dining room lights to be turned on,SwitchLightOn
818,twenty the entire appartment to be at too brightness,SetLightBrightness
819,on the entrance rid on,SwitchLightOn
820,want facilities to have lights on now,SwitchLightOn
821,want the lights to be pink,SetLightColor
822,want the kids bedroom to be set to level fifty,SetLightBrightness
823,bright in the large meeting room please,IncreaseBrightness
824,want the kids like to be pink,SetLightColor
825,want the kitchen lights to be twenty two,SetLightBrightness
826,want to light bulbs to be at level thirty nine,SetLightBrightness
827,want the light color changed to red,SetLightColor
828,want lighter in the garden turned on,SwitchLightOn
829,want the lights and the lounge to turn on,SwitchLightOn
830,want the light intensity to be at level ten,SetLightBrightness
831,want the light intensity turned up in the bedroom,IncreaseBrightness
832,want the light set to ten everywhere,SetLightBrightness
833,want light to be on,SwitchLightOn
834,brighten the lights,IncreaseBrightness
835,want the lighting increased,IncreaseBrightness
836,want the lighting situated at twenty two in the dining room,SetLightBrightness
837,want the tad rid Add,SetLightBrightness
838,want the lights decreased please,DecreaseBrightness
839,am are the five dim,DecreaseBrightness
840,turned the five in the out to pink,SetLightColor
841,want the lights in the bedroom on,SwitchLightOn
842,want the lights in the bedroom set to five,SetLightBrightness
843,want the lights in the laundry room to change to red,SetLightColor
844,want the lights in the pantry to be pink,SetLightColor
845,bright in the lights in the waiting room,IncreaseBrightness
846,on the lights near toilets to be pink,SetLightColor
847,and what ten lights off,SwitchLightOff
848,want the lights off everywhere,SwitchLightOff
849,twenty the light off in the meeting room,SwitchLightOff
850,one lights on,SwitchLightOn
851,want the lights on at the two waiting,SwitchLightOn
852,want to like brighness for the entire lot please,SwitchLightOn
853,want the lights on now,SwitchLightOn
854,want the light set two fifty in the kids room,SetLightBrightness
855,i'd on the lights to be at level twenty two,SetLightBrightness
856,brighten up the cubicle,IncreaseBrightness
857,want the lights to be blue in the bathroom,SetLightColor
858,want the lights to be brighter,IncreaseBrightness
859,want the lights to be changed to blue,SetLightColor
860,and want the lights to be dimmed,DecreaseBrightness
861,want the lights to be increased in brightness,IncreaseBrightness
862,want the lights to be increased,IncreaseBrightness
863,Will want the lights to be lowered,DecreaseBrightness
864,want the lights to be area please,SetLightColor
865,want the lights to be turned off,SwitchLightOff
866,want lights to be turned off in the vestibule,SwitchLightOff
867,garage,IncreaseBrightness
868,want the light turn down in the bedroom,DecreaseBrightness
869,want the lounge light on,SwitchLightOn
870,want the parking lights off,SwitchLightOff
871,twenty ten like turned on,SwitchLightOn
872,want the pretty room light off,SwitchLightOff
873,want the room brighter,IncreaseBrightness
874,want this studio to be dark,SwitchLightOff
875,what the toilet lights off,SwitchLightOff
876,want the all lights to be at twelve,SetLightBrightness
877,want the toilet lights to be on,SwitchLightOn
878,darkness is to percent in create down Place,SetLightBrightness
879,want be twenty will it Lessen level to power,SetLightBrightness
880,want the vestibule to shine at twelve percent percent,SetLightBrightness
881,want the waiting room lights at ten,SetLightBrightness
882,want this room at brightness level ten,SetLightBrightness
883,want to brighten the laundry room,IncreaseBrightness
884,want to change boardroom brightness to ten please,SetLightBrightness
885,want to change the light green,SetLightColor
886,want to change the light to blue instead.,SetLightColor
887,want two lights to lower setting please,DecreaseBrightness
888,want to glow here my appartment lights please,DecreaseBrightness
889,brightness house is decrease Help,SetLightBrightness
890,want to make the light dimmer,DecreaseBrightness
891,want to make the room brighter,IncreaseBrightness
892,one to rid the play two ten,SetLightBrightness
893,want to turn off the lights,SwitchLightOff
894,want to turn off the patio lamps,SwitchLightOff
895,want to change the brightness level in the patio to ten,SetLightBrightness
896,want you to switch off all the lights and my cubicle,SwitchLightOff
897,want you to turn off the lights in the small meeting room,SwitchLightOff
898,want you to turn the lights off in my room please,SwitchLightOff
899,brightness to seventy-three tree please,SetLightBrightness
900,it would like for the light to be brighter,IncreaseBrightness
901,would like for the lights to be,SetLightColor
902,would like green lights please,SetLightColor
903,would like lights on inside the house,SwitchLightOn
904,would like pink lights please,SetLightColor
905,would like inside Set level in the balcony we thirty can,SetLightBrightness
906,studio like the brightness of the lights to be level for,SetLightBrightness
907,would let the garage flat on fifty,SetLightBrightness
908,would like the lights to be turned on,SwitchLightOn
909,would like the lights less bright,DecreaseBrightness
910,activate the lights,SwitchLightOn
911,bring darkness to this room by turning off the lights,SwitchLightOff
912,would like the lights to change to green,SetLightColor
913,would like the lights turned off,SwitchLightOff
914,child's let the down flat on,SwitchLightOn
915,would like the vestibule will to be be,SetLightColor
916,would like the waiting room lights turned up,IncreaseBrightness
917,would prefer that the changing room lights be lowered,DecreaseBrightness
918,i'd light these lights on,SwitchLightOn
919,would like your let off,SwitchLightOff
920,i'd light for my lights to be flipped on now,SwitchLightOn
921,will be Make for the Make to be blue,SetLightColor
922,bring the cellar lights up to two,SetLightBrightness
923,i'd like for the lights to go on now,SwitchLightOn
924,i'd like it little do,DecreaseBrightness
925,like more lighting in the bedroom,IncreaseBrightness
926,i'd like the bedroom lights to be at ten percent percent,SetLightBrightness
927,red like the brightness changed in the made,SwitchLightOff
928,you like the brightness Set to twenty,SetLightBrightness
929,like the brightness turned down,DecreaseBrightness
930,i'd like to darkness are no,IncreaseBrightness
931,rid light the brightness turned up in the garage,IncreaseBrightness
932,i'd like the lights to be set to twelve,SetLightBrightness
933,can the changing room lights be turned on,SwitchLightOn
934,i'd like the kitchen to be brighter,IncreaseBrightness
935,like light to increase in the pantry,IncreaseBrightness
936,like the lit on the intense to be on,SwitchLightOn
937,i'd like the lights in the laundry room to be at level twenty two,SetLightBrightness
938,like the light should in the vestibule,SwitchLightOff
939,i'd like the lights to be shut off,SwitchLightOff
940,like the five to be shut down,SwitchLightOff
941,like the if to be turned on,SwitchLightOn
942,can the laundry room have green lights,SetLightColor
943,has like the lights to change in the large meeting room,SwitchLightOff
944,i'd like the lights to not be so bright,DecreaseBrightness
945,i'd like the lights turn down in the kids room,DecreaseBrightness
